,drugbank_id,name,groups,indication,smiles,type
1146,DB01414,Cefacetrile,experimental|vet_approved,Cefacetrile is a broad-spectrum first generation cephalosporin antibiotic effective in Gram-positive and Gram-negative bacterial infections,[H][C@]12SCC(COC(C)=O)=C(N1C(=O)[C@H]2NC(=O)CC#N)C(O)=O,small molecule
1147,DB01415,Ceftibuten,approved|investigational,"Indicated for the treatment of acute bacterial exacerbations of chronic bronchitis (ABECB), acute bacterial otitis media, pharyngitis, and tonsilitis",[H][C@]12SCC=C(N1C(=O)[C@H]2NC(=O)C(=C/CC(O)=O)\C1=CSC(N)=N1)C(O)=O,small molecule
1148,DB01416,Cefpodoxime,approved|vet_approved,Indicated for the treatment of patients with mild to moderate infections caused by susceptible strains of the designated microorganisms,[H][C@]12SCC(COC)=C(N1C(=O)[C@H]2NC(=O)C(=N/OC)\C1=CSC(N)=N1)C(O)=O,small molecule
1149,DB01418,Acenocoumarol,approved|investigational,For the treatment and prevention of thromboembolic diseases,CC(=O)CC(C1=CC=C(C=C1)[N+]([O-])=O)C1=C(O)C2=CC=CC=C2OC1=O,small molecule
1150,DB01419,Antrafenine,approved,Antrafenine is used as an anti-inflammatory and analgesic agent for the relief of mild to moderate pain,FC(F)(F)C1=CC(=CC=C1)N1CCN(CCOC(=O)C2=CC=CC=C2NC2=C3C=CC(=CC3=NC=C2)C(F)(F)F)CC1,small molecule
1151,DB01420,Testosterone propionate,approved|investigational|vet_approved|withdrawn,Testosterone propionate is used in veterinary practice in heifers in order to stimulate maximal growth,[H][C@@]12CC[C@H](OC(=O)CC)[C@@]1(C)CC[C@@]1([H])[C@@]2([H])CCC2=CC(=O)CC[C@]12C,small molecule
1152,DB01421,Paromomycin,approved|investigational,For the treatment of acute and chronic intestinal amebiasis (it is not effective in extraintestinal amebiasis),NC[C@@H]1O[C@H](O[C@@H]2[C@@H](CO)O[C@@H](O[C@@H]3[C@@H](O)[C@H](N)C[C@H](N)[C@H]3O[C@H]3O[C@H](CO)[C@@H](O)[C@H](O)[C@H]3N)[C@@H]2O)[C@H](N)[C@@H](O)[C@@H]1O,small molecule
1153,DB01424,Aminophenazone,approved|withdrawn,"Formerly widely used as an antipyretic and analgesic in rheumatism, neuritis, and common colds",CN(C)C1=C(C)N(C)N(C1=O)C1=CC=CC=C1,small molecule
1154,DB01426,Ajmaline,approved|experimental,For use as an antiarrhythmic agent,[H][C@]12C[C@]34[C@H](O)C1[C@@]1([H])C[C@]([H])(N2[C@H](O)[C@H]1CC)[C@]3([H])N(C)C1=CC=CC=C41,small molecule
1155,DB01427,Amrinone,approved,Used in the treatment of congestive heart failure,NC1=CC(=CNC1=O)C1=CC=NC=C1,small molecule
1156,DB01428,Oxybenzone,approved|investigational,Used as an ingredient in sunscreen and other cosmetics,COC1=CC(O)=C(C=C1)C(=O)C1=CC=CC=C1,small molecule
1157,DB01430,Almitrine,approved,For the treatment of chronic obstructive pulmonary disease,FC1=CC=C(C=C1)C(N1CCN(CC1)C1=NC(NCC=C)=NC(NCC=C)=N1)C1=CC=C(F)C=C1,small molecule
1158,DB01435,Antipyrine,approved|investigational,Antipyrine is an analgesic often used to test effects of other drugs on liver enzymes,CN1N(C(=O)C=C1C)C1=CC=CC=C1,small molecule
1159,DB01436,Alfacalcidol,approved|nutraceutical,"Alfacalcidol is indicated in adult patients with chronic renal failure for the management of hypocalcemia, secondary hyperparathyroidism, or osteodystrophy",CC(C)CCC[C@@H](C)[C@@]1([H])CC[C@@]2([H])\C(CCC[C@]12C)=C\C=C1\C[C@@H](O)C[C@H](O)C1=C,small molecule
1160,DB01437,Glutethimide,approved|illicit,For the treatment of insomnia,CCC1(CCC(=O)NC1=O)C1=CC=CC=C1,small molecule
1161,DB01438,Phenazopyridine,approved,Phenazopyridine hydrochloride is indicated to relieve uncomfortable symptoms that occur as a consequence of mucosal irritation of the lower urinary tract in adults,NC1=NC(N)=C(C=C1)\N=N\C1=CC=CC=C1,small molecule
1162,DB01440,gamma-Hydroxybutyric acid,approved|illicit|investigational,"Used as a general anesthetic, to treat conditions such as insomnia, clinical depression, narcolepsy, and alcoholism, and to improve athletic performance",OCCCC(O)=O,small molecule
1163,DB01452,Diamorphine,approved|illicit|investigational,"Diamorphine, as a prescription medication in the United Kingdom, is indicated for use in the treatment of severe pain associated with surgical procedures, myocardial infarction or pain in the terminally ill and for the relief of dyspnoea in acute pulmonary edema [L4999]",[H][C@@]12C=C[C@H](OC(C)=O)[C@@H]3OC4=C(OC(C)=O)C=CC5=C4[C@]13CCN(C)[C@@H]2C5,small molecule
1164,DB01497,Etorphine,illicit|vet_approved,Etorphine is only available for its use in veterinary,[H][C@]12CC3=C4C(OC5[C@@]4(CCN1C)[C@]21CC(C(C)(O)CCC)C5(OC)C=C1)=C(O)C=C3,small molecule
1165,DB01501,Difenoxin,approved|illicit,"Motofen(R) is a combination of atropine, an anticholinergic drug, and difenoxin, an antidiarrheal drug",OC(=O)C1(CCN(CCC(C#N)(C2=CC=CC=C2)C2=CC=CC=C2)CC1)C1=CC=CC=C1,small molecule
1166,DB01535,Carfentanil,illicit|investigational|vet_approved,Carfentanil is similar (but more potent) to the opioid analgesic fentanyl,CCC(=O)N(C1=CC=CC=C1)C1(CCN(CCC2=CC=CC=C2)CC1)C(=O)OC,small molecule
1167,DB01544,Flunitrazepam,approved|illicit,"For short-term treatment of severe insomnias, that are not responsive to other hypnotics",CN1C2=C(C=C(C=C2)[N+]([O-])=O)C(=NCC1=O)C1=CC=CC=C1F,small molecule
1168,DB01548,Diprenorphine,illicit|vet_approved,"Diprenorphine is indicated to reverse the effects of powerful opioids including etorphine and carfentanil, often used for tranquilizing large animals",[H][C@@]12OC3=C(O)C=CC4=C3[C@@]11CCN(CC3CC3)[C@]([H])(C4)[C@]11CC[C@@]2(OC)[C@H](C1)C(C)(C)O,small molecule
1169,DB01551,Dihydrocodeine,approved|illicit,"Dihydrocodeine is used for the treatment of moderate to severe pain, including post-operative and dental pain [2]",[H][C@@]12OC3=C4C(C[C@H]5N(C)CC[C@@]14[C@@]5([H])CC[C@@H]2O)=CC=C3OC,small molecule
1170,DB01558,Bromazepam,approved|illicit|investigational,"For the short-term treatment of insomnia, short-term treatment of anxiety or panic attacks, if a benzodiazepine is required, and the alleviation of the symptoms of alcohol- and opiate-withdrawal",BrC1=CC2=C(NC(=O)CN=C2C2=CC=CC=N2)C=C1,small molecule
1171,DB01559,Clotiazepam,approved|illicit,For the treatment of anxiety disorders,CCC1=CC2=C(S1)N(C)C(=O)CN=C2C1=CC=CC=C1Cl,small molecule
1172,DB01563,Chloral hydrate,approved|illicit|investigational|vet_approved,"Mainly used as a hypnotic in the treatment of insomnia; however, it is only effective as a hypnotic for short-term use",OC(O)C(Cl)(Cl)Cl,small molecule
1173,DB01574,Attapulgite,approved|vet_approved,"When used in medicine, it physically binds to acids and toxic substances in the stomach and digestive tract",[O--].[O--].[O--].[O--].[O--].[O--].[O--].[O--].[O--].[O--].[Mg++].[Al+3].[Si+4].[Si+4].[Si+4].[Si+4].[O-][H].[H]O[H].[H]O[H].[H]O[H].[H]O[H],small molecule
1174,DB01575,Kaolin,approved,"Used for upset stomach and diarrhea, a traditional medicine used in China, South America and Africa",O.O.[Al+3].[Al+3].[O-][Si]([O-])([O-])O[Si]([O-])([O-])[O-],small molecule
1175,DB01576,Dextroamphetamine,approved|illicit,Dextroamphetamine is indicated for the treatment of attention deficit hyperactivity disorder (ADHD),C[C@H](N)CC1=CC=CC=C1,small molecule
1176,DB01577,Metamfetamine,approved|illicit|withdrawn,For the treatment of Attention Deficit Disorder with Hyperactivity (ADHD) and exogenous obesity,CN[C@@H](C)CC1=CC=CC=C1,small molecule
1177,DB01579,Phendimetrazine,approved|illicit,Used in the management of exogenous obesity as a short term adjunct (a few weeks) in a regimen of weight reduction based on caloric restriction,C[C@H]1[C@@H](OCCN1C)C1=CC=CC=C1,small molecule
1178,DB01580,Oxprenolol,approved,"Used in the treatment of hypertension, angina pectoris, arrhythmias, and anxiety",CC(C)NCC(O)COC1=CC=CC=C1OCC=C,small molecule
1179,DB01581,Sulfamerazine,approved|vet_approved,A sulfanilamide that is used as an antibacterial agent,CC1=NC(NS(=O)(=O)C2=CC=C(N)C=C2)=NC=C1,small molecule
1180,DB01582,Sulfamethazine,approved|investigational|vet_approved,"For the treatment bacterial infections causing bronchitis, prostatitis and urinary tract infections",CC1=CC(C)=NC(NS(=O)(=O)C2=CC=C(N)C=C2)=N1,small molecule
1181,DB01583,Liotrix,approved,"May be used to treat primary, secondary or tertiary hypothyroidism",[Na+].[Na+].N[C@@H](CC1=CC(I)=C(OC2=CC(I)=C(O)C=C2)C(I)=C1)C([O-])=O.N[C@@H](CC1=CC(I)=C(OC2=CC(I)=C(O)C(I)=C2)C(I)=C1)C([O-])=O,small molecule
1182,DB01586,Ursodeoxycholic acid,approved|investigational,The drug decreases the absorption of cholesterol and is used to dissolve (cholesterol) gallstones in patients as an alternative to a surgical procedure to remove the gallstones,[H][C@@]1(CC[C@@]2([H])[C@]3([H])[C@@H](O)C[C@]4([H])C[C@H](O)CC[C@]4(C)[C@@]3([H])CC[C@]12C)[C@H](C)CCC(O)=O,small molecule
1183,DB01587,Ketazolam,approved,Ketazolam could be used for the treatment of anxiety,CN1C2=C(C=C(Cl)C=C2)C2(OC(C)=CC(=O)N2CC1=O)C1=CC=CC=C1,small molecule
1184,DB01588,Prazepam,approved|illicit,For the treatment of anxiety disorders,ClC1=CC2=C(C=C1)N(CC1CC1)C(=O)CN=C2C1=CC=CC=C1,small molecule
1185,DB01589,Quazepam,approved|illicit,Used to treat insomnia,FC1=CC=CC=C1C1=NCC(=S)N(CC(F)(F)F)C2=C1C=C(Cl)C=C2,small molecule
1186,DB01590,Everolimus,approved,"Everolimus is indicated for the treatment of postmenopausal women with advanced hormone receptor-positive, HER2-negative breast cancer (advanced HR+ BC) in combination with exemestane, after failure of treatment with letrozole or anastrozole",[H][C@@]1(C[C@@H](C)[C@]2([H])CC(=O)[C@H](C)\C=C(C)\[C@@H](O)[C@@H](OC)C(=O)[C@H](C)C[C@H](C)\C=C\C=C\C=C(C)\[C@H](C[C@]3([H])CC[C@@H](C)[C@@](O)(O3)C(=O)C(=O)N3CCCC[C@@]3([H])C(=O)O2)OC)CC[C@@H](OCCO)[C@@H](C1)OC,small molecule
1187,DB01591,Solifenacin,approved,"Solifenacin tablets are indicated to treat an overactive bladder with urinary incontinence, urgency, and frequency",O=C(O[C@H]1CN2CCC1CC2)N1CCC2=CC=CC=C2[C@@H]1C1=CC=CC=C1,small molecule
1188,DB01592,Iron,approved,Used in preventing and treating iron-deficiency anemia,[Fe],small molecule
1189,DB01593,Zinc,approved|investigational,"Zinc can be used for the treatment and prevention of zinc deficiency/its consequences, including stunted growth and acute diarrhea in children, and slowed wound healing",[Zn],small molecule
1190,DB01595,Nitrazepam,approved,"Used to treat short-term sleeping problems (insomnia), such as difficulty falling asleep, frequent awakenings during the night, and early-morning awakening",[O-][N+](=O)C1=CC2=C(NC(=O)CN=C2C2=CC=CC=C2)C=C1,small molecule
1191,DB01597,Cilastatin,approved|investigational,"Cilastatin is indicated, in combination with [imipenem] with or without [relebactam], for the treatment of bacterial infections including respiratory, skin, bone, gynecologic, urinary tract, and intra-abdominal as well as septicemia and endocarditis",CC1(C)C[C@@H]1C(=O)N\C(=C/CCCCSC[C@H](N)C(O)=O)C(O)=O,small molecule
1192,DB01598,Imipenem,approved,"Imipenem is indicated, in combination with [cilastatin] with or without [relebactam], for the treatment of bacterial infections including respiratory, skin, bone, gynecologic, urinary tract, and intra-abdominal as well as septicemia and endocarditis",[H][C@]12CC(SCC\N=C\N)=C(N1C(=O)[C@]2([H])[C@@H](C)O)C(O)=O,small molecule
1193,DB01599,Probucol,approved|investigational,Used to lower LDL and HDL cholesterol,CC(C)(SC1=CC(=C(O)C(=C1)C(C)(C)C)C(C)(C)C)SC1=CC(=C(O)C(=C1)C(C)(C)C)C(C)(C)C,small molecule
1194,DB01600,Tiaprofenic acid,approved,"Tiaprofenic acid is used to treat pain, especially arthritic pain",CC(C(O)=O)C1=CC=C(S1)C(=O)C1=CC=CC=C1,small molecule
1195,DB01601,Lopinavir,approved,"The combination product lopinavir/ritonavir, marketed under the brand name Kaletra, is indicated in combination with other antiretrovirals for the treatment of HIV-1 infection in adults and pediatric patients ≥14 days old",CC(C)[C@H](N1CCCNC1=O)C(=O)N[C@H](C[C@H](O)[C@H](CC1=CC=CC=C1)NC(=O)COC1=C(C)C=CC=C1C)CC1=CC=CC=C1,small molecule
1196,DB01602,Bacampicillin,approved|investigational,"For infections at the following sites: upper and lower respiratory tract; skin and soft tissue; urinary tract and acute uncomplicated gonococcal urethritis, when due to sensitive strains of the following organisms:  Gram-positive: streptococci (including <i>S",[H][C@]12SC(C)(C)[C@@H](N1C(=O)[C@H]2NC(=O)[C@H](N)C1=CC=CC=C1)C(=O)OC(C)OC(=O)OCC,small molecule
1197,DB01603,Meticillin,approved|investigational,"Used to treat infections caused by susceptible Gram-positive bacteria, particularly beta-lactamase-producing organisms such as <i>Staphylococcus aureus</i> that would otherwise be resistant to most penicillins",[H][C@]12SC(C)(C)[C@@H](N1C(=O)[C@H]2NC(=O)C1=C(OC)C=CC=C1OC)C(O)=O,small molecule
1198,DB01604,Pivampicillin,approved,"or the treatment of respiratory tract infections (including acute bronchitis, acute exacerbations of chronic bronchitis and pneumonia); ear, nose and throat infections; gynecological infections; urinary tract infections (including acute uncomplicated gonococcal urethritis) when caused by non penicillinase-producing susceptible strains of the following organisms: gram-positive organisms, e",[H][C@]12SC(C)(C)[C@@H](N1C(=O)[C@H]2NC(=O)[C@H](N)C1=CC=CC=C1)C(=O)OCOC(=O)C(C)(C)C,small molecule
1199,DB01605,Pivmecillinam,approved,"Used to treat infections due to mecillinam-sensitive organisms such as urinary tract infections, salmonellosis and typhoid fever",[H]C(=N[C@@H]1C(=O)N2[C@@H](C(=O)OCOC(=O)C(C)(C)C)C(C)(C)S[C@]12[H])N1CCCCCC1,small molecule
1200,DB01606,Tazobactam,approved,"Tazobactam is used in combination with piperacillin or ceftolozane to broaden the spectrum of piperacillin antibacterial action, treating susceptible infections",[H][C@@]12CC(=O)N1[C@@H](C(O)=O)[C@](C)(CN1C=CN=N1)S2(=O)=O,small molecule
1201,DB01607,Ticarcillin,approved|investigational|vet_approved,For the treatment of bacterial infections,[H][C@]12SC(C)(C)[C@@H](N1C(=O)[C@H]2NC(=O)[C@H](C(O)=O)C1=CSC=C1)C(O)=O,small molecule
1202,DB01608,Periciazine,approved|investigational,For use as adjunctive medication in some psychotic patients,OC1CCN(CCCN2C3=CC=CC=C3SC3=C2C=C(C=C3)C#N)CC1,small molecule
1203,DB01609,Deferasirox,approved|investigational,For the treatment of chronic iron overload due to blood transfusions (transfusional hemosiderosis) in patients 2 years of age and older,OC(=O)C1=CC=C(C=C1)N1N=C(N=C1C1=CC=CC=C1O)C1=CC=CC=C1O,small molecule
1204,DB01610,Valganciclovir,approved|investigational,Valganciclovir is an antiviral medication used for the treatment of cytomegalovirus infections,CC(C)[C@H](N)C(=O)OCC(CO)OCN1C=NC2=C1NC(N)=NC2=O,small molecule
1205,DB01611,Hydroxychloroquine,approved,"Hydroxychloroquine is indicated for the prophylaxis of malaria where chloroquine resistance is not reported, treatment of uncomplicated malaria (caused by _P",CCN(CCO)CCCC(C)NC1=C2C=CC(Cl)=CC2=NC=C1,small molecule
1206,DB01612,Amyl Nitrite,approved,For the rapid relief of angina pectoris,CCCCCON=O,small molecule
1207,DB01613,Erythrityl tetranitrate,approved|experimental|investigational,For the prevention of angina,[O-][N+](=O)OC[C@@H](O[N+]([O-])=O)[C@H](CO[N+]([O-])=O)O[N+]([O-])=O,small molecule
1208,DB01614,Acepromazine,experimental|vet_approved,Acepromazine was first used in humans in the 1950s as an antipsychotic agent,CN(C)CCCN1C2=CC=CC=C2SC2=C1C=C(C=C2)C(C)=O,small molecule
1209,DB01616,Alverine,approved|investigational,Used to relieve cramps or spasms of the stomach and intestines,CCN(CCCC1=CC=CC=C1)CCCC1=CC=CC=C1,small molecule
1210,DB01618,Molindone,approved,Molindone is used for the management of the manifestations of psychotic disorders,CCC1=C(C)NC2=C1C(=O)C(CN1CCOCC1)CC2,small molecule
1211,DB01619,Phenindamine,approved,"Used to treat sneezing, runny nose, itching, watery eyes, hives, rashes, itching, and other symptoms of allergies and the common cold",CN1CCC2=C(C1)C(C1=CC=CC=C21)C1=CC=CC=C1,small molecule
1212,DB01620,Pheniramine,approved,Pheniramine is commonly used in over-the-counter products to treat seasonal allergies or cold and flu symptoms,CN(C)CCC(C1=CC=CC=C1)C1=CC=CC=N1,small molecule
1213,DB01621,Pipotiazine,approved|investigational,For the maintenance treatment of chronic non-agitated schizophrenic patients,CN(C)S(=O)(=O)C1=CC2=C(SC3=CC=CC=C3N2CCCN2CCC(CCO)CC2)C=C1,small molecule
1214,DB01623,Thiothixene,approved,For the management of schizophrenia,CN(C)S(=O)(=O)C1=CC2=C(SC3=CC=CC=C3\C2=C\CCN2CCN(C)CC2)C=C1,small molecule
1215,DB01624,Zuclopenthixol,approved|investigational,Used in the management of acute psychoses such as mania or schizophrenia,OCCN1CCN(CC\C=C2\C3=C(SC4=C2C=C(Cl)C=C4)C=CC=C3)CC1,small molecule
1216,DB01625,Isopropamide,approved|vet_approved,"For the treatment of a wide range of gastrointestinal disorders, including such conditions as peptic ulcer, gastritis, hyperchlorhydria, functional diarrhea, irritable or spastic colon, pyloroduodenal irritability, pylorospasm, acute nonspecific gastroenteritis, biliary dyskinesia and chronic cholelithiasis, duodenitis, gastrointestinal spasm; it may also be used to treat genitourinary spasm",CC(C)[N+](C)(CCC(C(N)=O)(C1=CC=CC=C1)C1=CC=CC=C1)C(C)C,small molecule
1217,DB01626,Pargyline,approved,For the treatment of moderate to severe hypertension,CN(CC#C)CC1=CC=CC=C1,small molecule
1218,DB01627,Lincomycin,approved|vet_approved,"Lincomycin is indicated for the treatment of serious bacterial infections by susceptible strains of streptococci, pneumococci, and staphylococci in patients who are allergic to penicillins or for situations in which a penicillin is deemed inappropriate",[H][C@]1(C[C@@H](CCC)CN1C)C(=O)N[C@H]([C@@H](C)O)[C@H]1O[C@H](SC)[C@H](O)[C@@H](O)[C@H]1O,small molecule
1219,DB01628,Etoricoxib,approved|investigational,"For the treatment of rheumatoid arthritis, osteoarthritis, ankylosing spondylitis, chronic low back pain, acute pain and gout",CC1=NC=C(C=C1)C1=C(C=C(Cl)C=N1)C1=CC=C(C=C1)S(C)(=O)=O,small molecule
1220,DB01638,Sorbitol,approved,Used as a non-stimulant laxative via an oral suspension or enema,OC[C@H](O)[C@@H](O)[C@H](O)[C@H](O)CO,small molecule
1221,DB01656,Roflumilast,approved,"Administered orally, roflumilast is indicated to reduce the risk of COPD exacerbations in patients with severe COPD associated with chronic bronchitis and a history of exacerbations",FC(F)OC1=C(OCC2CC2)C=C(C=C1)C(=O)NC1=C(Cl)C=NC=C1Cl,small molecule
1222,DB01708,Prasterone,approved|investigational|nutraceutical,DHEA is taken as a supplement for a variety of unsubstantiated indications,[H][C@@]12CCC(=O)[C@@]1(C)CC[C@@]1([H])[C@@]2([H])CC=C2C[C@@]([H])(O)CC[C@]12C,small molecule
1223,DB01764,Dalfopristin,approved,For the treatment of bacterial infections (usually in combination with quinupristin),CCN(CC)CCS(=O)(=O)[C@@H]1CCN2[C@H]1C(=O)O[C@H](C(C)C)[C@H](C)\C=C\C(=O)NC\C=C\C(\C)=C\[C@@H](O)CC(=O)CC1=NC(=CO1)C2=O,small molecule
1224,DB01783,Pantothenic acid,approved|nutraceutical|vet_approved,"Studied for the treatment of many uses such as treatment of testicular torsion, diabetic ulceration, wound healing, acne, obesity, diabetic peripheral polyneuropathy",CC(C)(CO)[C@@H](O)C(=O)NCCC(O)=O,small molecule
1225,DB01914,D-glucose,approved|investigational|vet_approved,"Glucose pharmaceutical formulations (oral tablets, injections) are indicated for caloric supply and carbohydrate supplementation in case of nutrient deprivation",[H][C@@](O)(CO)[C@@]([H])(O)[C@]([H])(O)[C@@]([H])(O)C=O,small molecule
1226,DB01956,Taurine,approved|nutraceutical,The use of diet supplements containing taurine is indicated for the nutritional support of infants and young pediatric patients requiring total parenteral nutrition via central or peripheral routes,NCCS(O)(=O)=O,small molecule
1227,DB02300,Calcipotriol,approved,For the treatment of moderate plaque psoriasis in adults,O[C@H](\C=C\[C@@H](C)[C@@]1([H])CC[C@@]2([H])\C(CCC[C@]12C)=C\C=C1\C[C@@H](O)C[C@H](O)C1=C)C1CC1,small molecule
1228,DB02546,Vorinostat,approved|investigational,"For the treatment of cutaneous manifestations in patients with cutaneous T-cell lymphoma who have progressive, persistent or recurrent disease on or following two systemic therapies",ONC(=O)CCCCCCC(=O)NC1=CC=CC=C1,small molecule
1229,DB02659,Cholic Acid,approved,"Oral cholic acid is indicated for: treatment of bile acid synthesis disorders due to single enzyme defects; and as adjunctive treatment of peroxisomal disorders including Zellweger spectrum disorders in patients who exhibit manifestations of liver disease, steatorrhea or complications from decreased fat soluble vitamin absorption",[H][C@@](C)(CCC(O)=O)[C@@]1([H])CC[C@@]2([H])[C@]3([H])[C@]([H])(O)C[C@]4([H])C[C@]([H])(O)CC[C@]4(C)[C@@]3([H])C[C@]([H])(O)[C@]12C,small molecule
1230,DB02703,Fusidic acid,approved|investigational,For the treatment of bacterial infections,[H][C@@]12C[C@@H](O)[C@@]3([H])[C@@]4(C)CC[C@@H](O)[C@@H](C)[C@]4([H])CC[C@]3(C)[C@@]1(C)C[C@H](OC(C)=O)\C2=C(\CCC=C(C)C)C(O)=O,small molecule
1231,DB02959,Oxitriptan,approved|investigational|nutraceutical,"For use as an antidepressant, appetite suppressant, and sleep aid",N[C@@H](CC1=CNC2=C1C=C(O)C=C2)C(O)=O,small molecule
1232,DB03088,Pidolic acid,approved|investigational,There is currently no clinically approved and/or marketed medicine that relies upon pidolic acid as an active ingredient for any formal therapeutic indication,OC(=O)[C@@H]1CCC(=O)N1,small molecule
1233,DB03128,Acetylcholine,approved|investigational,"Used to obtain miosis of the iris in seconds after delivery of the lens in cataract surgery, in penetrating keratoplasty, iridectomy and other anterior segment surgery where rapid miosis may be required",CC(=O)OCC[N+](C)(C)C,small molecule
1234,DB03147,Flavin adenine dinucleotide,approved,"Used to treat eye diseases caused by vitamin B2 deficiency, such as keratitis and blepharitis",CC1=CC2=C(C=C1C)N(C[C@H](O)[C@H](O)[C@H](O)CO[P@](O)(=O)O[P@@](O)(=O)OC[C@H]1O[C@H]([C@H](O)[C@@H]1O)N1C=NC3=C1N=CN=C3N)C1=NC(=O)NC(=O)C1=N2,small molecule
1235,DB03166,Acetic acid,approved,Used to treat infections in the ear canal,CC(O)=O,small molecule
1236,DB03209,Oteracil,approved,Oteracil is used as an adjunct to antineoplastic therapy,OC(=O)C1=NC(=O)NC(=O)N1,small molecule
1237,DB03255,Phenol,approved|experimental,"Phenol is primarily indicated for minor sore throat pain, sore mouth, minor mouth irritation, and pain associated with canker sores",OC1=CC=CC=C1,small molecule
1238,DB03619,Deoxycholic acid,approved,For improvement in appearance of moderate to severe fullness associated with submental fat in adults,[H][C@@]12CC[C@H]([C@H](C)CCC(O)=O)[C@@]1(C)[C@@H](O)C[C@@]1([H])[C@@]2([H])CC[C@]2([H])C[C@H](O)CC[C@]12C,small molecule
1239,DB03754,Tromethamine,approved,For the prevention and correction of metabolic acidosis,NC(CO)(CO)CO,small molecule
1240,DB03756,Doconexent,approved|investigational,Used as a high-docosahexaenoic acid (DHA) oral supplement,CC\C=C/C\C=C/C\C=C/C\C=C/C\C=C/C\C=C/CCC(O)=O,small molecule
1241,DB03766,Propanoic acid,approved|vet_approved,"Propanoic acid and various direct sodium or calcium salt formulations of the acid are currently most commonly approved and indicated by organizations like the FDA and EMA for use as an antibacterial food additive preservative in animal feed and food for human consumption [L2715, L2716]",CCC(O)=O,small molecule
1242,DB03843,Formaldehyde,approved|vet_approved,Use for drying skin before or after surgical removal of warts or where dryness is required,[H]C([H])=O,small molecule
1243,DB03904,Urea,approved|investigational,"Urea is used topically for debridement and promotion of normal healing of hyperkeratotic surface lesions, particularly where healing is retarded by local infection, necrotic tissue, fibrinous or purulent debris or eschar",NC(N)=O,small molecule
1244,DB04209,Dequalinium,approved|investigational,"Dequalinium is used in several OTC products to treat mouth infections and inflammation, such as tonsillitis, pharyngitis, and gingivitis",CC1=CC(N)=C2C=CC=CC2=[N+]1CCCCCCCCCC[N+]1=C(C)C=C(N)C2=C1C=CC=C2,small molecule
1245,DB04339,Carbocisteine,approved|investigational,Carbocisteine is indicated over the counter and in prescription formulas to clear airway secretions in conditions associated with increased mucus,N[C@@H](CSCC(O)=O)C(O)=O,small molecule
1246,DB04398,Lactic acid,approved|vet_approved,For use as an alkalinizing agent,CC(O)C(O)=O,small molecule
1247,DB04570,Latamoxef,approved|investigational,Latamoxef is an oxacephem antibiotic usually grouped with the cephalosporins,[H][C@]12OCC(CSC3=NN=NN3C)=C(N1C(=O)[C@]2(NC(=O)C(C(O)=O)C1=CC=C(O)C=C1)OC)C(O)=O,small molecule
1248,DB04571,Trioxsalen,approved,Trioxsalen is a pigmenting photosensitizing agent used in conjunction with ultraviolet light in the treatment of vitiligo,CC1=CC2=CC3=C(OC(=O)C=C3C)C(C)=C2O1,small molecule
1249,DB04572,Thiotepa,approved|investigational,ThioTEPA is used a as conditioning treatment prior to allogeneic or autologous haematopoietic progenitor cell transplantation (HPCT) in haematological diseases in adult and paediatric patients,S=P(N1CC1)(N1CC1)N1CC1,small molecule
1250,DB04573,Estriol,approved|investigational|vet_approved,Used as a test to determine the general health of an unborn fetus,[H][C@@]12C[C@@H](O)[C@H](O)[C@@]1(C)CC[C@]1([H])C3=C(CC[C@@]21[H])C=C(O)C=C3,small molecule
1251,DB04574,Estrone sulfate,approved,"Estropipate is used for the treatment of moderate to severe vasomotor symptoms associated with the monopause, and moderate to severe symptoms of vulval and vaginal atrophy associated with the menopause",[H][C@@]12CCC(=O)[C@@]1(C)CC[C@]1([H])C3=C(CC[C@@]21[H])C=C(OS(O)(=O)=O)C=C3,small molecule
1252,DB04575,Quinestrol,approved,"Used in hormone replacement therapy, treating symptoms of menopause such as hot flashes",[H][C@@]12CC[C@@](O)(C#C)[C@@]1(C)CC[C@]1([H])C3=C(CC[C@@]21[H])C=C(OC1CCCC1)C=C3,small molecule
1253,DB04626,Apramycin,experimental|vet_approved,For the treatment of bacterial infections in animals,CN[C@H]1[C@@H](O)[C@H]2O[C@H](O[C@@H]3[C@@H](N)C[C@@H](N)[C@H](O)[C@H]3O)[C@H](N)C[C@@H]2O[C@@H]1O[C@H]1O[C@H](CO)[C@@H](N)[C@H](O)[C@H]1O,small molecule
