,drugbank_id,name,groups,indication,inchi,type
1637,DB09140,Oxygen,approved|vet_approved,"Oxygen therapy in clinical settings is used across diverse specialties, including various types of anoxia, hypoxia or dyspnea and any other disease states and conditions that reduce the efficiency of gas exchange and oxygen consumption such as respiratory illnesses, trauma, poisonings and drug overdoses",InChI=1S/O2/c1-2,small molecule
1638,DB09142,Sincalide,approved,"As the product Kinevac (FDA), sincalide is used for the following indications: 1) to stimulate gallbladder contraction, as may be assessed by various methods of diagnostic imaging, or to obtain by duodenal aspiration a sample of concentrated bile for analysis of cholesterol, bile salts, phospholipids, and crystals; (2) to stimulate pancreatic secretion (especially in conjunction with secretin) prior to obtaining a duodenal aspirate for analysis of enzyme activity, composition, and cytology; (3) to accelerate the transit of a barium meal through the small bowel, thereby decreasing the time and extent of radiation associated with fluoroscopy and x-ray examination of the intestinal tract","InChI=1S/C49H62N10O16S3/c1-76-18-16-34(55-47(69)37(58-44(66)32(50)23-41(61)62)21-28-12-14-30(15-13-28)75-78(72,73)74)45(67)53-26-40(60)54-38(22-29-25-52-33-11-7-6-10-31(29)33)48(70)56-35(17-19-77-2)46(68)59-39(24-42(63)64)49(71)57-36(43(51)65)20-27-8-4-3-5-9-27/h3-15,25,32,34-39,52H,16-24,26,50H2,1-2H3,(H2,51,65)(H,53,67)(H,54,60)(H,55,69)(H,56,70)(H,57,71)(H,58,66)(H,59,68)(H,61,62)(H,63,64)(H,72,73,74)/t32-,34-,35-,36-,37-,38-,39-/m0/s1",small molecule
1639,DB09143,Sonidegib,approved|investigational,Sonidegib is approved for use in the US and EU for treatment of adults with locally advanced basal cell carcinoma (BCC) that has recurred post surgery or radiation therapy,"InChI=1S/C26H26F3N3O3/c1-16-14-32(15-17(2)34-16)24-12-9-20(13-30-24)31-25(33)23-6-4-5-22(18(23)3)19-7-10-21(11-8-19)35-26(27,28)29/h4-13,16-17H,14-15H2,1-3H3,(H,31,33)/t16-,17+",small molecule
1640,DB09144,Uridine triacetate,approved|investigational,"Marketed as the product Xuriden (FDA), uridine triacetate is indicated for the treatment of hereditary orotic aciduria","InChI=1S/C15H18N2O9/c1-7(18)23-6-10-12(24-8(2)19)13(25-9(3)20)14(26-10)17-5-4-11(21)16-15(17)22/h4-5,10,12-14H,6H2,1-3H3,(H,16,21,22)/t10-,12-,13-,14-/m1/s1",small molecule
1641,DB09145,Water,approved,"For diluting or dissolving drugs for intravenous, intramuscular or subcutaneous injection, according to instructions of the manufacturer of the drug to be administered [FDA Label]",InChI=1S/H2O/h1H2,small molecule
1642,DB09146,Iron sucrose,approved,Iron sucrose is elemental iron as an injection,"InChI=1S/C12H22O11.5Fe.2Na.4H2O.8O/c13-1-4-6(16)8(18)9(19)11(21-4)23-12(3-15)10(20)7(17)5(2-14)22-12;;;;;;;;;;;;;;;;;;;/h4-11,13-20H,1-3H2;;;;;;;;4*1H2;;;;;;;;/q;5*+3;2*+1;;;;;8*-2/p-1/t4-,5-,6-,7-,8+,9-,10+,11-,12+;;;;;;;;;;;;;;;;;;;/m1.................../s1",small molecule
1643,DB09148,Florbetaben (18F),approved,Florbetaben is a radioactive diagnostic agent indicated for Positron Emission Tomography (PET) imaging of the brain to estimate -amyloid neuritic plaque density in adult patients with cognitive impairment who are being evaluated for Alzheimers Disease (AD) and other causes of cognitive decline,"InChI=1S/C21H26FNO3/c1-23-20-8-4-18(5-9-20)2-3-19-6-10-21(11-7-19)26-17-16-25-15-14-24-13-12-22/h2-11,23H,12-17H2,1H3/b3-2+/i22-1",small molecule
1644,DB09149,Florbetapir (18F),approved|investigational,Florbetapir 18F is indicated for Positron Emission Tomography (PET) imaging of the brain to estimate -amyloid neuritic plaque density in adult patients with cognitive impairment who are being evaluated for Alzheimer's Disease (AD) and other causes of cognitive decline,"InChI=1S/C20H25FN2O3/c1-22-19-7-4-17(5-8-19)2-3-18-6-9-20(23-16-18)26-15-14-25-13-12-24-11-10-21/h2-9,16,22H,10-15H2,1H3/b3-2+/i21-1",small molecule
1645,DB09151,Flutemetamol (18F),approved|investigational,Flutemetamol F18 is indicated for Positron Emission Tomography (PET) imaging of the brain to estimate  amyloid neuritic plaque density in adult patients with cognitive impairment who are being evaluated for Alzheimer's disease (AD) or other causes of cognitive decline,"InChI=1S/C14H11FN2OS/c1-16-11-4-2-8(6-10(11)15)14-17-12-5-3-9(18)7-13(12)19-14/h2-7,16,18H,1H3/i15-1",small molecule
1646,DB09152,Nitrogen,approved|vet_approved,Liquid nitrogen is used mainly as a cryogenic agent for the treatment of various benign and malignant skin lesions,InChI=1S/N2/c1-2,small molecule
1647,DB09153,Sodium chloride,approved|vet_approved,This intravenous solution is indicated for use in adults and pediatric patients as a source of electrolytes and water for hydration,InChI=1S/ClH.Na/h1H;/q;+1/p-1,small molecule
1648,DB09154,Sodium citrate,approved|investigational,Used as an anticoagulant during plasmophoresis as well as a neutralizing agent in the treatment of upset stomach and acidic urine [FDA Label] [L788] [L789],"InChI=1S/C6H8O7.3Na/c7-3(8)1-6(13,5(11)12)2-4(9)10;;;/h13H,1-2H2,(H,7,8)(H,9,10)(H,11,12);;;/q;3*+1/p-3",small molecule
1649,DB09155,Helium,approved|investigational|vet_approved,For use in patients who are not getting enough oxygen into their blood due to blockages in the lungs from pathological conditions or injuries,InChI=1S/He,small molecule
1650,DB09156,Iopromide,approved,"Iopromide, as the product Iovist, is indicated for use as an X-ray contrast agent in the following procedures:
Intra-arterial digital subtraction angiography (IA-DSA) (150 mg I/mL) 
Cerebral arteriography and peripheral arteriography (300 mg I/mL) 
Coronary arteriography and left ventriculography, visceral angiography and aortography (370 mg I/mL) 
Peripheral venography (240 mg I/mL) 
Excretory urography (300 mg I/mL)
Contrast computed tomography (CT) imaging of head and body (300 mg I/mL and 370 mg I/mL) ","InChI=1S/C18H24I3N3O8/c1-24(4-9(28)6-26)18(31)12-13(19)11(17(30)22-3-8(27)5-25)14(20)16(15(12)21)23-10(29)7-32-2/h8-9,25-28H,3-7H2,1-2H3,(H,22,30)(H,23,29)",small molecule
1651,DB09157,Carbon dioxide,approved|investigational|vet_approved,"Carbon dioxide is commonly used as an insufflation gas for minimal invasive surgery (laparoscopy, endoscopy, and arthroscopy) to enlarge and stabilize body cavities to provide better visibility of the surgical area",InChI=1S/CO2/c2-1-3,small molecule
1652,DB09158,Trypan blue free acid,approved,"Trypan blue is indicated for use as an aid in ophthalmic surgery by staining the epiretinal membranes during ophthalmic surgical vitrectomy procedures, facilitating removal of the tissue","InChI=1S/C34H28N6O14S4/c1-15-7-17(3-5-25(15)37-39-31-27(57(49,50)51)11-19-9-21(55(43,44)45)13-23(35)29(19)33(31)41)18-4-6-26(16(2)8-18)38-40-32-28(58(52,53)54)12-20-10-22(56(46,47)48)14-24(36)30(20)34(32)42/h3-14,41-42H,35-36H2,1-2H3,(H,43,44,45)(H,46,47,48)(H,49,50,51)(H,52,53,54)/b39-37+,40-38+",small molecule
1653,DB09160,Technetium Tc-99m tetrofosmin,approved,Technetium-99m tetrofosmin is indicated for the diagnosis of heart abnormalities by exercise myocardial scintigraphy,"InChI=1S/2C18H40O4P2.2H2O.Tc/c2*1-5-19-9-13-23(14-10-20-6-2)17-18-24(15-11-21-7-3)16-12-22-8-4;;;/h2*5-18H2,1-4H3;2*1H2;/i;;;;1+1",small molecule
1654,DB09161,Technetium Tc-99m sestamibi,approved|investigational,Technetium Tc 99m Sestamibi is indicated for: 1) detecting coronary artery disease by localizing myocardial ischemia (reversible defects) and infarction (non-reversible defects); and 2) evaluating myocardial function and developing information for use in patient management decisions,"InChI=1S/6C6H11NO.Tc/c6*1-6(2,8-4)5-7-3;/h6*5H2,1-2,4H3;/q;;;;;;+1",small molecule
1655,DB09164,Technetium Tc-99m disofenin,approved,Technetium Tc99m Disofenin is indicated as a hepatobiliary imaging agent,"InChI=1S/C18H26N2O5.Tc/c1-11(2)13-6-5-7-14(12(3)4)18(13)19-15(21)8-20(9-16(22)23)10-17(24)25;/h5-7,11-12H,8-10H2,1-4H3,(H,19,21)(H,22,23)(H,24,25);/i;1+2",small molecule
1656,DB09165,Technetium Tc-99m pyrophosphate,approved,"For use as a skeletal imaging agent used to demonstrate areas of altered osteogenesis, and a cardiac imaging agent used as an adjunct in the diagnosis of acute myocardial infarction [FDA Label]","InChI=1S/H4O7P2.Tc/c1-8(2,3)7-9(4,5)6;/h(H2,1,2,3)(H2,4,5,6);/q;+4/p-4/i;1+2",small molecule
1657,DB09167,Dosulepin,approved,"Indicated in the treatment of symptoms of depressive illness, especially where an anti-anxiety effect is required","InChI=1S/C19H21NS/c1-20(2)13-7-11-17-16-9-4-3-8-15(16)14-21-19-12-6-5-10-18(17)19/h3-6,8-12H,7,13-14H2,1-2H3/b17-11+",small molecule
1658,DB09183,Dasabuvir,approved,"Dasabuvir, in combination with [DB09296], [DB09297], and [DB00503] (as Viekira Pak) is indicated for the treatment of patients with HCV genotype 1a with [DB00811] or genotype 1b without [DB00811] including those with compensated cirrhosis [FDA Label]","InChI=1S/C26H27N3O5S/c1-26(2,3)22-15-20(29-11-10-23(30)27-25(29)31)14-21(24(22)34-4)18-7-6-17-13-19(28-35(5,32)33)9-8-16(17)12-18/h6-15,28H,1-5H3,(H,27,30,31)",small molecule
1659,DB09185,Viloxazine,approved|investigational|withdrawn,Viloxazine is a selective norepinephrine reuptake inhibitor indicated for the treatment of Attention Deficit Hyperactivity Disorder (ADHD) in adults and pediatric patients 6 years and older,"InChI=1S/C13H19NO3/c1-2-15-12-5-3-4-6-13(12)17-10-11-9-14-7-8-16-11/h3-6,11,14H,2,7-10H2,1H3",small molecule
1660,DB09195,Lorpiprazole,approved,"In 2016, lorpiprazole was classified in the ""Chemical structure-related drug-like criteria of global approved drugs"" as an antipsychotic and anxiolytic","InChI=1S/C21H26F3N5/c22-21(23,24)16-4-2-5-17(13-16)28-11-9-27(10-12-28)8-7-19-25-26-20-18-6-1-3-15(18)14-29(19)20/h2,4-5,13,15,18H,1,3,6-12,14H2/t15-,18-/m0/s1",small molecule
1661,DB09205,Moxisylyte,approved|investigational,"By the WHO, moxisylyte is indicated for the symptomatic management of sequelae of cerebral infarction or hemorrhage","InChI=1S/C16H25NO3/c1-11(2)14-10-15(20-13(4)18)12(3)9-16(14)19-8-7-17(5)6/h9-11H,7-8H2,1-6H3",small molecule
1662,DB09209,Pholcodine,approved|illicit,Pholcodine is indicated as a cough suppressant for the temporary relief of non-productive dry cough,"InChI=1S/C23H30N2O4/c1-24-7-6-23-16-3-4-18(26)22(23)29-21-19(5-2-15(20(21)23)14-17(16)24)28-13-10-25-8-11-27-12-9-25/h2-5,16-18,22,26H,6-14H2,1H3/t16-,17+,18-,22-,23-/m0/s1",small molecule
1663,DB09210,Piracetam,approved|investigational,"Indicated in adult patients suffering from myoclonus of cortical origin, irrespective of aetiology, and should be used in combination with other anti-myoclonic therapies [L1125]","InChI=1S/C6H10N2O2/c7-5(9)4-8-3-1-2-6(8)10/h1-4H2,(H2,7,9)",small molecule
1664,DB09212,Loxoprofen,approved,Loxoprofen is non-steroidal anti-inflammatory medication (NSAID) indicated for pain and inflammation related to musculoskeletal and joint disorders,"InChI=1S/C15H18O3/c1-10(15(17)18)12-7-5-11(6-8-12)9-13-3-2-4-14(13)16/h5-8,10,13H,2-4,9H2,1H3,(H,17,18)",small molecule
1665,DB09213,Dexibuprofen,approved|investigational,"For more information, refer to [ibuprofen]","InChI=1S/C13H18O2/c1-9(2)8-11-4-6-12(7-5-11)10(3)13(14)15/h4-7,9-10H,8H2,1-3H3,(H,14,15)/t10-/m0/s1",small molecule
1666,DB09214,Dexketoprofen,approved|investigational,"For short-term treatment of mild to moderate pain, including dysmenorrhoea, musculoskeletal pain and toothache [L1302]","InChI=1S/C16H14O3/c1-11(16(18)19)13-8-5-9-14(10-13)15(17)12-6-3-2-4-7-12/h2-11H,1H3,(H,18,19)/t11-/m0/s1",small molecule
1667,DB09216,Tolfenamic acid,approved|investigational,"In the information for tolfenamic acid, it is stated that this drug, being an NSAID, is effective in treating the pain associated with the acute attack of migraines in adults","InChI=1S/C14H12ClNO2/c1-9-11(15)6-4-8-12(9)16-13-7-3-2-5-10(13)14(17)18/h2-8,16H,1H3,(H,17,18)",small molecule
1668,DB09217,Firocoxib,experimental|vet_approved,Used for the treatment of pain inflammation and fever in horses and dogs,"InChI=1S/C17H20O5S/c1-17(2)14(12-6-8-13(9-7-12)23(3,19)20)15(16(18)22-17)21-10-11-4-5-11/h6-9,11H,4-5,10H2,1-3H3",small molecule
1669,DB09219,Bisoxatin,approved,For use in the treatment of constipation in the absence of bowel obstruction and for surgical preparation of the colon [L926],"InChI=1S/C20H15NO4/c22-15-9-5-13(6-10-15)20(14-7-11-16(23)12-8-14)19(24)21-17-3-1-2-4-18(17)25-20/h1-12,22-23H,(H,21,24)",small molecule
1670,DB09220,Nicorandil,approved|investigational,Indicated for the prevention and treatment of chronic stable angina pectoris and reduction in the risk of acute coronary syndromes,"InChI=1S/C8H9N3O4/c12-8(7-2-1-3-9-6-7)10-4-5-15-11(13)14/h1-3,6H,4-5H2,(H,10,12)",small molecule
1671,DB09225,Zotepine,approved|investigational|withdrawn,"Zotepine, like other atypical antipsychotics, is considered as the first-line treatment in newly diagnosed schizophrenia","InChI=1S/C18H18ClNOS/c1-20(2)9-10-21-16-11-13-5-3-4-6-17(13)22-18-8-7-14(19)12-15(16)18/h3-8,11-12H,9-10H2,1-2H3",small molecule
1672,DB09236,Lacidipine,approved|investigational,"Indicated for the treatment of hypertension either alone or in combination with other antihypertensive agents, including -adrenoceptor antagonists, diuretics, and ACE-inhibitors [L1126]","InChI=1S/C26H33NO6/c1-8-31-24(29)21-16(3)27-17(4)22(25(30)32-9-2)23(21)19-13-11-10-12-18(19)14-15-20(28)33-26(5,6)7/h10-15,23,27H,8-9H2,1-7H3/b15-14+",small molecule
1673,DB09237,Levamlodipine,approved|investigational,Levamlodipine is indicated alone or in combination to treat hypertension in adults and children,"InChI=1S/C20H25ClN2O5/c1-4-28-20(25)18-15(11-27-10-9-22)23-12(2)16(19(24)26-3)17(18)13-7-5-6-8-14(13)21/h5-8,17,23H,4,9-11,22H2,1-3H3/t17-/m0/s1",small molecule
1674,DB09238,Manidipine,approved|investigational,For the treatment of hypertension,"InChI=1S/C35H38N4O6/c1-24-30(34(40)44-3)32(28-15-10-16-29(23-28)39(42)43)31(25(2)36-24)35(41)45-22-21-37-17-19-38(20-18-37)33(26-11-6-4-7-12-26)27-13-8-5-9-14-27/h4-16,23,32-33,36H,17-22H2,1-3H3",small molecule
1675,DB09241,Methylene blue,approved|investigational,Indicated for the treatment of pediatric and adult patients with acquired methemoglobinemia,"InChI=1S/C16H18N3S.ClH/c1-18(2)11-5-7-13-15(9-11)20-16-10-12(19(3)4)6-8-14(16)17-13;/h5-10H,1-4H3;1H/q+1;/p-1",small molecule
1676,DB09242,Moxonidine,approved|investigational,For the treatment of mild to moderate essential or primary hypertension [L1025],"InChI=1S/C9H12ClN5O/c1-5-13-7(10)6(8(14-5)16-2)15-9-11-3-4-12-9/h3-4H2,1-2H3,(H2,11,12,15)",small molecule
1677,DB09256,Tegafur,approved|investigational,Indicated for the treatment of cancer usually in combination with other biochemically modulating drugs,"InChI=1S/C8H9FN2O3/c9-5-4-11(6-2-1-3-14-6)8(13)10-7(5)12/h4,6H,1-3H2,(H,10,12,13)",small molecule
1678,DB09257,Gimeracil,approved,Gimeracil is used as an adjunct to antineoplastic therapy,"InChI=1S/C5H4ClNO2/c6-3-2-7-5(9)1-4(3)8/h1-2H,(H2,7,8,9)",small molecule
1679,DB09267,Strontium ranelate,approved|withdrawn,"Strontium ranelate is therapeutically indicated for the treatment of severe osteoperosis in: a) postmenopasual women, and b) adult men, who are at high risk of fractures, for whom treatment with other medical products approved for the treatment of osteoperosis is not possible due to, for example, contraindications or intolerance","InChI=1S/C12H10N2O8S.2Sr/c13-2-6-5(1-7(15)16)10(12(21)22)23-11(6)14(3-8(17)18)4-9(19)20;;/h1,3-4H2,(H,15,16)(H,17,18)(H,19,20)(H,21,22);;/q;2*+2/p-4",small molecule
1680,DB09268,Picosulfuric acid,approved,"Sodium picosulfate, in combination with magnesium oxide and anhydrous citric acid, is indicated for cleansing of the colon as a preparation for colonoscopy in adults and pediatric patients ages 9 years and older","InChI=1S/C18H15NO8S2/c20-28(21,22)26-15-8-4-13(5-9-15)18(17-3-1-2-12-19-17)14-6-10-16(11-7-14)27-29(23,24)25/h1-12,18H,(H,20,21,22)(H,23,24,25)",small molecule
1681,DB09269,Phenylacetic acid,approved,For use as adjunctive therapy for the treatment of acute hyperammonemia and associated encephalopathy in patients with deficiencies in enzymes of the urea cycle,"InChI=1S/C8H8O2/c9-8(10)6-7-4-2-1-3-5-7/h1-5H,6H2,(H,9,10)",small molecule
1682,DB09270,Ubidecarenone,approved|investigational|nutraceutical,"The diet supplements containing ubidecarenone are indicated, as stated in the product label, to assist individuals with cardiovascular complaints including congestive heart failure and systolic hypertension","InChI=1S/C59H90O4/c1-44(2)24-15-25-45(3)26-16-27-46(4)28-17-29-47(5)30-18-31-48(6)32-19-33-49(7)34-20-35-50(8)36-21-37-51(9)38-22-39-52(10)40-23-41-53(11)42-43-55-54(12)56(60)58(62-13)59(63-14)57(55)61/h24,26,28,30,32,34,36,38,40,42H,15-23,25,27,29,31,33,35,37,39,41,43H2,1-14H3/b45-26+,46-28+,47-30+,48-32+,49-34+,50-36+,51-38+,52-40+,53-42+",small molecule
1683,DB09272,Eluxadoline,approved|investigational,For the treatment of irritable bowel syndrome with diarrhea (IBS-D),"InChI=1S/C32H35N5O5/c1-18-12-23(29(34)38)13-19(2)24(18)15-26(33)31(39)37(17-21-10-11-28(42-4)25(14-21)32(40)41)20(3)30-35-16-27(36-30)22-8-6-5-7-9-22/h5-14,16,20,26H,15,17,33H2,1-4H3,(H2,34,38)(H,35,36)(H,40,41)/t20-,26-/m0/s1",small molecule
1684,DB09274,Artesunate,approved|investigational,Artesunate is indicated for the initial treatment of severe malaria in adult and pediatric patients,"InChI=1S/C19H28O8/c1-10-4-5-13-11(2)16(23-15(22)7-6-14(20)21)24-17-19(13)12(10)8-9-18(3,25-17)26-27-19/h10-13,16-17H,4-9H2,1-3H3,(H,20,21)/t10-,11-,12+,13+,16-,17-,18-,19-/m1/s1",small molecule
1685,DB09275,Bismuth subcitrate potassium,approved|investigational,For the treatment of peptic ulcer and gastro-oesophageal reflux disease (GORD),"InChI=1S/2C6H7O7.Bi.5K/c2*7-3(8)1-6(13,5(11)12)2-4(9)10;;;;;;/h2*1-2H2,(H,7,8)(H,9,10)(H,11,12);;;;;;/q2*-1;+3;5*+1/p-6",small molecule
1686,DB09276,Sodium aurothiomalate,approved|investigational,A disease-modifying antirheumatic drug (DMARD) indicated for the symptomatic treatment of arthritis,"InChI=1S/C4H6O4S.Au.2Na/c5-3(6)1-2(9)4(7)8;;;/h2,9H,1H2,(H,5,6)(H,7,8);;;/q;3*+1/p-3",small molecule
1687,DB09277,Choline C 11,approved|investigational,"Choline C11 is indicated for its use in positron emission tomography (PET) imaging in patients with suspected prostate cancer recurrence and non-informative bone scintigraphy, computerized tomography or magnetic resonance imaging","InChI=1S/C5H14NO.ClH/c1-6(2,3)4-5-7;/h7H,4-5H2,1-3H3;1H/q+1;/p-1/i1-1;",small molecule
1688,DB09278,Activated charcoal,approved,Used as a antidote to treat poisonings following excessive oral ingestion of certain medications or poisons,InChI=1S/C,small molecule
1689,DB09280,Lumacaftor,approved,"When used in combination with the drug [lumacaftor] as the product Orkambi, ivacaftor is indicated for the management of CF in patients aged one year and older who are homozygous for the _F508del_ mutation in the CFTR gene","InChI=1S/C24H18F2N2O5/c1-13-5-8-19(27-20(13)14-3-2-4-15(11-14)21(29)30)28-22(31)23(9-10-23)16-6-7-17-18(12-16)33-24(25,26)32-17/h2-8,11-12H,9-10H2,1H3,(H,29,30)(H,27,28,31)",small molecule
1690,DB09281,Magnesium trisilicate,approved,For the treatment of peptic ulcers,"InChI=1S/2Mg.O8Si3/c;;1-9(2)7-11(5,6)8-10(3)4/q2*+2;-4",small molecule
1691,DB09282,Molsidomine,approved|investigational,"The indications for use of molsidomine include ischemic heart disease, angina, chronic heart failure, and pulmonary hypertension [L1370, L1371]","InChI=1S/C9H14N4O4/c1-2-16-9(14)10-8-7-13(11-17-8)12-3-5-15-6-4-12/h7H,2-6H2,1H3",small molecule
1692,DB09291,Rolapitant,approved|investigational,This drug is indicated in adults in combination with other antiemetics for the prevention of delayed nausea and vomiting associated with emetogenic chemotherapy,"InChI=1S/C25H26F6N2O2/c1-16(17-11-19(24(26,27)28)13-20(12-17)25(29,30)31)35-15-23(18-5-3-2-4-6-18)10-9-22(14-32-23)8-7-21(34)33-22/h2-6,11-13,16,32H,7-10,14-15H2,1H3,(H,33,34)/t16-,22-,23-/m1/s1",small molecule
1693,DB09292,Sacubitril,approved,Used in combination with valsartan to reduce the risk of cardiovascular events in patients with chronic heart failure (NYHA Class II-IV) and reduced ejection fraction,"InChI=1S/C24H29NO5/c1-3-30-24(29)17(2)15-21(25-22(26)13-14-23(27)28)16-18-9-11-20(12-10-18)19-7-5-4-6-8-19/h4-12,17,21H,3,13-16H2,1-2H3,(H,25,26)(H,27,28)/t17-,21+/m1/s1",small molecule
1694,DB09293,Iodide I-131,approved|investigational,Therapeutic solutions of Sodium Iodide-131 are indicated for the treatment of hyperthyroidism and thyroid carcinomas that take up iodine,InChI=1S/HI/h1H/p-1/i1+4,small molecule
1695,DB09296,Ombitasvir,approved|investigational,"When used in combination with [DB09297] and [DB00503] (as the fixed dose product Technivie), Ombitasvir is indicated in combination with [DB00811] for the treatment of patients with genotype 4 chronic hepatitis C virus (HCV) infection without cirrhosis [L866]","InChI=1S/C50H67N7O8/c1-30(2)42(53-48(62)64-8)46(60)55-28-10-12-40(55)44(58)51-35-20-14-32(15-21-35)38-26-27-39(57(38)37-24-18-34(19-25-37)50(5,6)7)33-16-22-36(23-17-33)52-45(59)41-13-11-29-56(41)47(61)43(31(3)4)54-49(63)65-9/h14-25,30-31,38-43H,10-13,26-29H2,1-9H3,(H,51,58)(H,52,59)(H,53,62)(H,54,63)/t38-,39-,40-,41-,42-,43-/m0/s1",small molecule
1696,DB09297,Paritaprevir,approved|investigational,"When used within the fixed-dose combination product with [DB09296], [DB09183], and [DB00503] as the FDA-approved product Viekira Pak, paritaprevir is indicated for the treatment of HCV genotype 1b without cirrhosis or with compensated cirrhosis, and when combined with [DB00811] for the treatment of HCV genotype 1a without cirrhosis or with compensated cirrhosis","InChI=1S/C40H43N7O7S/c1-24-21-42-33(22-41-24)35(48)43-32-16-6-4-2-3-5-11-25-20-40(25,39(51)46-55(52,53)27-17-18-27)45-36(49)34-19-26(23-47(34)38(32)50)54-37-30-14-8-7-12-28(30)29-13-9-10-15-31(29)44-37/h5,7-15,21-22,25-27,32,34H,2-4,6,16-20,23H2,1H3,(H,43,48)(H,45,49)(H,46,51)/b11-5-/t25-,26-,32+,34+,40-/m1/s1",small molecule
1697,DB09299,Tenofovir alafenamide,approved,Tenofovir alafenamide is indicated for the treatment of hepatitis B virus infection in adults and pediatric patients 12 years of age and older with compensated liver disease,"InChI=1S/C21H29N6O5P/c1-14(2)31-21(28)16(4)26-33(29,32-17-8-6-5-7-9-17)13-30-15(3)10-27-12-25-18-19(22)23-11-24-20(18)27/h5-9,11-12,14-16H,10,13H2,1-4H3,(H,26,29)(H2,22,23,24)/t15-,16+,33+/m1/s1",small molecule
1698,DB09300,Butylscopolamine,approved|investigational|vet_approved,Used to treat abdmoninal cramping and pain [FDA Label],"InChI=1S/C21H30NO4/c1-3-4-10-22(2)17-11-15(12-18(22)20-19(17)26-20)25-21(24)16(13-23)14-8-6-5-7-9-14/h5-9,15-20,23H,3-4,10-13H2,1-2H3/q+1/t15-,16-,17-,18+,19-,20+,22?/m1/s1",small molecule
1699,DB09313,Ioxaglic acid,approved|investigational,"This medicinal product is for diagnostic use only in adults and children as a low-osmolality medium [L1883], [A7924]","InChI=1S/C24H21I6N5O8/c1-7(37)35(3)20-17(29)10(21(39)31-2)13(25)11(18(20)30)23(41)33-6-8(38)34-19-15(27)9(22(40)32-4-5-36)14(26)12(16(19)28)24(42)43/h36H,4-6H2,1-3H3,(H,31,39)(H,32,40)(H,33,41)(H,34,38)(H,42,43)",small molecule
1700,DB09314,Technetium Tc-99m pertechnetate,approved|investigational,"Sodium Pertechnetate Tc99m Injection is indicated for use in adults for imaging in the following tissues: thyroid, salivary gland,  urinary bladder (for detection of vesico-ureteral reflux), and nasolacrimal drainage system (dacryoscintigraphy)",InChI=1S/4H2O.Tc/h4*1H2;/q;;;;-1/i;;;;1+1,small molecule
1701,DB09315,Xenon-133,approved,Inhalation of Xenon Xe 133 Gas has proved valuable for the evaluation of pulmonary function and for imaging the lungs,InChI=1S/Xe/i1+2,small molecule
1702,DB09316,Thallous chloride,approved,For use as a diagnostic radiopharmaceutical,InChI=1S/ClH.Tl/h1H;/q;+1/p-1,small molecule
1703,DB09319,Carindacillin,approved|investigational,"For the treatment of acute and chronic infections of the upper and lower urinary tract and in asymptomatic bacteriuria (due to susceptible strains Escherichia coli, Proteus mirabilis, Morganella morganii, Providencia rettgeri, Proteus vulgaris, Pseudomonas, Enterobacter, and Enterococci","InChI=1S/C26H26N2O6S/c1-26(2)20(24(31)32)28-22(30)19(23(28)35-26)27-21(29)18(15-7-4-3-5-8-15)25(33)34-17-12-11-14-9-6-10-16(14)13-17/h3-5,7-8,11-13,18-20,23H,6,9-10H2,1-2H3,(H,27,29)(H,31,32)/t18?,19-,20+,23-/m1/s1",small molecule
1704,DB09320,Procaine benzylpenicillin,approved|vet_approved,"For the treatment of a number of bacterial infections such as syphilis, anthrax, mouth infections, pneumonia and diphtheria","InChI=1S/C16H18N2O4S.C13H20N2O2/c1-16(2)12(15(21)22)18-13(20)11(14(18)23-16)17-10(19)8-9-6-4-3-5-7-9;1-3-15(4-2)9-10-17-13(16)11-5-7-12(14)8-6-11/h3-7,11-12,14H,8H2,1-2H3,(H,17,19)(H,21,22);5-8H,3-4,9-10,14H2,1-2H3/t11-,12+,14-;/m1./s1",small molecule
1705,DB09321,Zinc oxide,approved,For adjunctive treatment of diaper dermatitis,InChI=1S/O.Zn,small molecule
1706,DB09322,Zinc sulfate,approved|investigational,This medication is a mineral used to treat or prevent low levels of zinc alone and together with oral rehydration therapy (ORT),"InChI=1S/H2O4S.Zn/c1-5(2,3)4;/h(H2,1,2,3,4);/q;+2/p-2",small molecule
1707,DB09324,Sulbactam,approved,Sulbactam is currently available in combination products with ampicillin,"InChI=1S/C8H11NO5S/c1-8(2)6(7(11)12)9-4(10)3-5(9)15(8,13)14/h5-6H,3H2,1-2H3,(H,11,12)/t5-,6+/m1/s1",small molecule
1708,DB09325,Sodium fluoride,approved,Sodium fluoride in the oral or topical form is indicated for the prevention and control of dental caries and for the maintenance of dental health,InChI=1S/FH.Na/h1H;/q;+1/p-1,small molecule
1709,DB09326,Ammonia N-13,approved,For diagnostic Positron Emission Tomography (PET) imaging of the myocardium under rest or pharmacologic stress conditions to evaluate myocardial perfusion in patients with suspected or existing coronary artery disease,InChI=1S/H3N/h1H3/i1-1,small molecule
