,drugbank_id,name,groups,indication,inchi,type
1151,DB01419,Antrafenine,approved,Antrafenine is used as an anti-inflammatory and analgesic agent for the relief of mild to moderate pain,"InChI=1S/C30H26F6N4O2/c31-29(32,33)20-4-3-5-22(18-20)40-14-12-39(13-15-40)16-17-42-28(41)24-6-1-2-7-25(24)38-26-10-11-37-27-19-21(30(34,35)36)8-9-23(26)27/h1-11,18-19H,12-17H2,(H,37,38)",small molecule
1152,DB01420,Testosterone propionate,approved|investigational|vet_approved|withdrawn,Testosterone propionate is used in veterinary practice in heifers in order to stimulate maximal growth,"InChI=1S/C22H32O3/c1-4-20(24)25-19-8-7-17-16-6-5-14-13-15(23)9-11-21(14,2)18(16)10-12-22(17,19)3/h13,16-19H,4-12H2,1-3H3/t16-,17-,18-,19-,21-,22-/m0/s1",small molecule
1153,DB01421,Paromomycin,approved|investigational,For the treatment of acute and chronic intestinal amebiasis (it is not effective in extraintestinal amebiasis),"InChI=1S/C23H45N5O14/c24-2-7-13(32)15(34)10(27)21(37-7)41-19-9(4-30)39-23(17(19)36)42-20-12(31)5(25)1-6(26)18(20)40-22-11(28)16(35)14(33)8(3-29)38-22/h5-23,29-36H,1-4,24-28H2/t5-,6+,7+,8-,9-,10-,11-,12+,13-,14-,15-,16-,17-,18-,19-,20-,21-,22-,23+/m1/s1",small molecule
1154,DB01424,Aminophenazone,approved|withdrawn,"Formerly widely used as an antipyretic and analgesic in rheumatism, neuritis, and common colds","InChI=1S/C13H17N3O/c1-10-12(14(2)3)13(17)16(15(10)4)11-8-6-5-7-9-11/h5-9H,1-4H3",small molecule
1155,DB01426,Ajmaline,approved|experimental,For use as an antiarrhythmic agent,"InChI=1S/C20H26N2O2/c1-3-10-11-8-14-17-20(12-6-4-5-7-13(12)21(17)2)9-15(16(11)18(20)23)22(14)19(10)24/h4-7,10-11,14-19,23-24H,3,8-9H2,1-2H3/t10-,11-,14-,15-,16?,17-,18+,19+,20+/m0/s1",small molecule
1156,DB01427,Amrinone,approved,Used in the treatment of congestive heart failure,"InChI=1S/C10H9N3O/c11-9-5-8(6-13-10(9)14)7-1-3-12-4-2-7/h1-6H,11H2,(H,13,14)",small molecule
1157,DB01428,Oxybenzone,approved|investigational,Used as an ingredient in sunscreen and other cosmetics,"InChI=1S/C14H12O3/c1-17-11-7-8-12(13(15)9-11)14(16)10-5-3-2-4-6-10/h2-9,15H,1H3",small molecule
1158,DB01430,Almitrine,approved,For the treatment of chronic obstructive pulmonary disease,"InChI=1S/C26H29F2N7/c1-3-13-29-24-31-25(30-14-4-2)33-26(32-24)35-17-15-34(16-18-35)23(19-5-9-21(27)10-6-19)20-7-11-22(28)12-8-20/h3-12,23H,1-2,13-18H2,(H2,29,30,31,32,33)",small molecule
1159,DB01435,Antipyrine,approved|investigational,Antipyrine is an analgesic often used to test effects of other drugs on liver enzymes,"InChI=1S/C11H12N2O/c1-9-8-11(14)13(12(9)2)10-6-4-3-5-7-10/h3-8H,1-2H3",small molecule
1160,DB01436,Alfacalcidol,approved|nutraceutical,"Alfacalcidol is indicated in adult patients with chronic renal failure for the management of hypocalcemia, secondary hyperparathyroidism, or osteodystrophy","InChI=1S/C27H44O2/c1-18(2)8-6-9-19(3)24-13-14-25-21(10-7-15-27(24,25)5)11-12-22-16-23(28)17-26(29)20(22)4/h11-12,18-19,23-26,28-29H,4,6-10,13-17H2,1-3,5H3/b21-11+,22-12-/t19-,23-,24-,25+,26+,27-/m1/s1",small molecule
1161,DB01437,Glutethimide,approved|illicit,For the treatment of insomnia,"InChI=1S/C13H15NO2/c1-2-13(10-6-4-3-5-7-10)9-8-11(15)14-12(13)16/h3-7H,2,8-9H2,1H3,(H,14,15,16)",small molecule
1162,DB01438,Phenazopyridine,approved,Phenazopyridine hydrochloride is indicated to relieve uncomfortable symptoms that occur as a consequence of mucosal irritation of the lower urinary tract in adults,"InChI=1S/C11H11N5/c12-10-7-6-9(11(13)14-10)16-15-8-4-2-1-3-5-8/h1-7H,(H4,12,13,14)/b16-15+",small molecule
1163,DB01440,gamma-Hydroxybutyric acid,approved|illicit|investigational,"Used as a general anesthetic, to treat conditions such as insomnia, clinical depression, narcolepsy, and alcoholism, and to improve athletic performance","InChI=1S/C4H8O3/c5-3-1-2-4(6)7/h5H,1-3H2,(H,6,7)",small molecule
1164,DB01452,Diamorphine,approved|illicit|investigational,"Diamorphine, as a prescription medication in the United Kingdom, is indicated for use in the treatment of severe pain associated with surgical procedures, myocardial infarction or pain in the terminally ill and for the relief of dyspnoea in acute pulmonary edema [L4999]","InChI=1S/C21H23NO5/c1-11(23)25-16-6-4-13-10-15-14-5-7-17(26-12(2)24)20-21(14,8-9-22(15)3)18(13)19(16)27-20/h4-7,14-15,17,20H,8-10H2,1-3H3/t14-,15+,17-,20-,21-/m0/s1",small molecule
1165,DB01497,Etorphine,illicit|vet_approved,Etorphine is only available for its use in veterinary,"InChI=1S/C25H33NO4/c1-5-8-22(2,28)17-14-23-9-10-25(17,29-4)21-24(23)11-12-26(3)18(23)13-15-6-7-16(27)20(30-21)19(15)24/h6-7,9-10,17-18,21,27-28H,5,8,11-14H2,1-4H3/t17?,18-,21?,22?,23-,24+,25?/m1/s1",small molecule
1166,DB01501,Difenoxin,approved|illicit,"Motofen(R) is a combination of atropine, an anticholinergic drug, and difenoxin, an antidiarrheal drug","InChI=1S/C28H28N2O2/c29-22-28(24-12-6-2-7-13-24,25-14-8-3-9-15-25)18-21-30-19-16-27(17-20-30,26(31)32)23-10-4-1-5-11-23/h1-15H,16-21H2,(H,31,32)",small molecule
1167,DB01535,Carfentanil,illicit|investigational|vet_approved,Carfentanil is similar (but more potent) to the opioid analgesic fentanyl,"InChI=1S/C24H30N2O3/c1-3-22(27)26(21-12-8-5-9-13-21)24(23(28)29-2)15-18-25(19-16-24)17-14-20-10-6-4-7-11-20/h4-13H,3,14-19H2,1-2H3",small molecule
1168,DB01544,Flunitrazepam,approved|illicit,"For short-term treatment of severe insomnias, that are not responsive to other hypnotics","InChI=1S/C16H12FN3O3/c1-19-14-7-6-10(20(22)23)8-12(14)16(18-9-15(19)21)11-4-2-3-5-13(11)17/h2-8H,9H2,1H3",small molecule
1169,DB01548,Diprenorphine,illicit|vet_approved,"Diprenorphine is indicated to reverse the effects of powerful opioids including etorphine and carfentanil, often used for tranquilizing large animals","InChI=1S/C26H35NO4/c1-23(2,29)18-13-24-8-9-26(18,30-3)22-25(24)10-11-27(14-15-4-5-15)19(24)12-16-6-7-17(28)21(31-22)20(16)25/h6-7,15,18-19,22,28-29H,4-5,8-14H2,1-3H3/t18-,19-,22-,24-,25+,26-/m1/s1",small molecule
1170,DB01551,Dihydrocodeine,approved|illicit,"Dihydrocodeine is used for the treatment of moderate to severe pain, including post-operative and dental pain [2]","InChI=1S/C18H23NO3/c1-19-8-7-18-11-4-5-13(20)17(18)22-16-14(21-2)6-3-10(15(16)18)9-12(11)19/h3,6,11-13,17,20H,4-5,7-9H2,1-2H3/t11-,12+,13-,17-,18-/m0/s1",small molecule
1171,DB01558,Bromazepam,approved|illicit|investigational,"For the short-term treatment of insomnia, short-term treatment of anxiety or panic attacks, if a benzodiazepine is required, and the alleviation of the symptoms of alcohol- and opiate-withdrawal","InChI=1S/C14H10BrN3O/c15-9-4-5-11-10(7-9)14(17-8-13(19)18-11)12-3-1-2-6-16-12/h1-7H,8H2,(H,18,19)",small molecule
1172,DB01559,Clotiazepam,approved|illicit,For the treatment of anxiety disorders,"InChI=1S/C16H15ClN2OS/c1-3-10-8-12-15(11-6-4-5-7-13(11)17)18-9-14(20)19(2)16(12)21-10/h4-8H,3,9H2,1-2H3",small molecule
1173,DB01563,Chloral hydrate,approved|illicit|investigational|vet_approved,"Mainly used as a hypnotic in the treatment of insomnia; however, it is only effective as a hypnotic for short-term use","InChI=1S/C2H3Cl3O2/c3-2(4,5)1(6)7/h1,6-7H",small molecule
1174,DB01574,Attapulgite,approved|vet_approved,"When used in medicine, it physically binds to acids and toxic substances in the stomach and digestive tract",InChI=1S/Al.Mg.5H2O.10O.4Si/h;;5*1H2;;;;;;;;;;;;;;/q+3;+2;;;;;;10*-2;4*+4/p-1,small molecule
1175,DB01575,Kaolin,approved,"Used for upset stomach and diarrhea, a traditional medicine used in China, South America and Africa","InChI=1S/2Al.O7Si2.2H2O/c;;1-8(2,3)7-9(4,5)6;;/h;;;2*1H2/q2*+3;-6;;",small molecule
1176,DB01576,Dextroamphetamine,approved|illicit,Dextroamphetamine is indicated for the treatment of attention deficit hyperactivity disorder (ADHD),"InChI=1S/C9H13N/c1-8(10)7-9-5-3-2-4-6-9/h2-6,8H,7,10H2,1H3/t8-/m0/s1",small molecule
1177,DB01577,Metamfetamine,approved|illicit|withdrawn,For the treatment of Attention Deficit Disorder with Hyperactivity (ADHD) and exogenous obesity,"InChI=1S/C10H15N/c1-9(11-2)8-10-6-4-3-5-7-10/h3-7,9,11H,8H2,1-2H3/t9-/m0/s1",small molecule
1178,DB01579,Phendimetrazine,approved|illicit,Used in the management of exogenous obesity as a short term adjunct (a few weeks) in a regimen of weight reduction based on caloric restriction,"InChI=1S/C12H17NO/c1-10-12(14-9-8-13(10)2)11-6-4-3-5-7-11/h3-7,10,12H,8-9H2,1-2H3/t10-,12+/m0/s1",small molecule
1179,DB01580,Oxprenolol,approved,"Used in the treatment of hypertension, angina pectoris, arrhythmias, and anxiety","InChI=1S/C15H23NO3/c1-4-9-18-14-7-5-6-8-15(14)19-11-13(17)10-16-12(2)3/h4-8,12-13,16-17H,1,9-11H2,2-3H3",small molecule
1180,DB01581,Sulfamerazine,approved|vet_approved,A sulfanilamide that is used as an antibacterial agent,"InChI=1S/C11H12N4O2S/c1-8-6-7-13-11(14-8)15-18(16,17)10-4-2-9(12)3-5-10/h2-7H,12H2,1H3,(H,13,14,15)",small molecule
1181,DB01582,Sulfamethazine,approved|investigational|vet_approved,"For the treatment bacterial infections causing bronchitis, prostatitis and urinary tract infections","InChI=1S/C12H14N4O2S/c1-8-7-9(2)15-12(14-8)16-19(17,18)11-5-3-10(13)4-6-11/h3-7H,13H2,1-2H3,(H,14,15,16)",small molecule
1182,DB01583,Liotrix,approved,"May be used to treat primary, secondary or tertiary hypothyroidism","InChI=1S/C15H11I4NO4.C15H12I3NO4.2Na/c16-8-4-7(5-9(17)13(8)21)24-14-10(18)1-6(2-11(14)19)3-12(20)15(22)23;16-9-6-8(1-2-13(9)20)23-14-10(17)3-7(4-11(14)18)5-12(19)15(21)22;;/h1-2,4-5,12,21H,3,20H2,(H,22,23);1-4,6,12,20H,5,19H2,(H,21,22);;/q;;2*+1/p-2/t2*12-;;/m00../s1",small molecule
1183,DB01586,Ursodeoxycholic acid,approved|investigational,The drug decreases the absorption of cholesterol and is used to dissolve (cholesterol) gallstones in patients as an alternative to a surgical procedure to remove the gallstones,"InChI=1S/C24H40O4/c1-14(4-7-21(27)28)17-5-6-18-22-19(9-11-24(17,18)3)23(2)10-8-16(25)12-15(23)13-20(22)26/h14-20,22,25-26H,4-13H2,1-3H3,(H,27,28)/t14-,15+,16-,17-,18+,19+,20+,22+,23+,24-/m1/s1",small molecule
1184,DB01587,Ketazolam,approved,Ketazolam could be used for the treatment of anxiety,"InChI=1S/C20H17ClN2O3/c1-13-10-18(24)23-12-19(25)22(2)17-9-8-15(21)11-16(17)20(23,26-13)14-6-4-3-5-7-14/h3-11H,12H2,1-2H3",small molecule
1185,DB01588,Prazepam,approved|illicit,For the treatment of anxiety disorders,"InChI=1S/C19H17ClN2O/c20-15-8-9-17-16(10-15)19(14-4-2-1-3-5-14)21-11-18(23)22(17)12-13-6-7-13/h1-5,8-10,13H,6-7,11-12H2",small molecule
1186,DB01589,Quazepam,approved|illicit,Used to treat insomnia,"InChI=1S/C17H11ClF4N2S/c18-10-5-6-14-12(7-10)16(11-3-1-2-4-13(11)19)23-8-15(25)24(14)9-17(20,21)22/h1-7H,8-9H2",small molecule
1187,DB01590,Everolimus,approved,"Everolimus is indicated for the treatment of postmenopausal women with advanced hormone receptor-positive, HER2-negative breast cancer (advanced HR+ BC) in combination with exemestane, after failure of treatment with letrozole or anastrozole","InChI=1S/C53H83NO14/c1-32-16-12-11-13-17-33(2)44(63-8)30-40-21-19-38(7)53(62,68-40)50(59)51(60)54-23-15-14-18-41(54)52(61)67-45(35(4)28-39-20-22-43(66-25-24-55)46(29-39)64-9)31-42(56)34(3)27-37(6)48(58)49(65-10)47(57)36(5)26-32/h11-13,16-17,27,32,34-36,38-41,43-46,48-49,55,58,62H,14-15,18-26,28-31H2,1-10H3/b13-11+,16-12+,33-17+,37-27+/t32-,34-,35-,36-,38-,39+,40+,41+,43-,44+,45+,46-,48-,49+,53-/m1/s1",small molecule
1188,DB01591,Solifenacin,approved,"Solifenacin tablets are indicated to treat an overactive bladder with urinary incontinence, urgency, and frequency","InChI=1S/C23H26N2O2/c26-23(27-21-16-24-13-10-18(21)11-14-24)25-15-12-17-6-4-5-9-20(17)22(25)19-7-2-1-3-8-19/h1-9,18,21-22H,10-16H2/t21-,22-/m0/s1",small molecule
1189,DB01592,Iron,approved,Used in preventing and treating iron-deficiency anemia,InChI=1S/Fe,small molecule
1190,DB01593,Zinc,approved|investigational,"Zinc can be used for the treatment and prevention of zinc deficiency/its consequences, including stunted growth and acute diarrhea in children, and slowed wound healing",InChI=1S/Zn,small molecule
1191,DB01595,Nitrazepam,approved,"Used to treat short-term sleeping problems (insomnia), such as difficulty falling asleep, frequent awakenings during the night, and early-morning awakening","InChI=1S/C15H11N3O3/c19-14-9-16-15(10-4-2-1-3-5-10)12-8-11(18(20)21)6-7-13(12)17-14/h1-8H,9H2,(H,17,19)",small molecule
1192,DB01597,Cilastatin,approved|investigational,"Cilastatin is indicated, in combination with [imipenem] with or without [relebactam], for the treatment of bacterial infections including respiratory, skin, bone, gynecologic, urinary tract, and intra-abdominal as well as septicemia and endocarditis","InChI=1S/C16H26N2O5S/c1-16(2)8-10(16)13(19)18-12(15(22)23)6-4-3-5-7-24-9-11(17)14(20)21/h6,10-11H,3-5,7-9,17H2,1-2H3,(H,18,19)(H,20,21)(H,22,23)/b12-6-/t10-,11+/m1/s1",small molecule
1193,DB01598,Imipenem,approved,"Imipenem is indicated, in combination with [cilastatin] with or without [relebactam], for the treatment of bacterial infections including respiratory, skin, bone, gynecologic, urinary tract, and intra-abdominal as well as septicemia and endocarditis","InChI=1S/C12H17N3O4S/c1-6(16)9-7-4-8(20-3-2-14-5-13)10(12(18)19)15(7)11(9)17/h5-7,9,16H,2-4H2,1H3,(H2,13,14)(H,18,19)/t6-,7-,9-/m1/s1",small molecule
1194,DB01599,Probucol,approved|investigational,Used to lower LDL and HDL cholesterol,"InChI=1S/C31H48O2S2/c1-27(2,3)21-15-19(16-22(25(21)32)28(4,5)6)34-31(13,14)35-20-17-23(29(7,8)9)26(33)24(18-20)30(10,11)12/h15-18,32-33H,1-14H3",small molecule
1195,DB01600,Tiaprofenic acid,approved,"Tiaprofenic acid is used to treat pain, especially arthritic pain","InChI=1S/C14H12O3S/c1-9(14(16)17)11-7-8-12(18-11)13(15)10-5-3-2-4-6-10/h2-9H,1H3,(H,16,17)",small molecule
1196,DB01601,Lopinavir,approved,"The combination product lopinavir/ritonavir, marketed under the brand name Kaletra, is indicated in combination with other antiretrovirals for the treatment of HIV-1 infection in adults and pediatric patients 14 days old","InChI=1S/C37H48N4O5/c1-25(2)34(41-20-12-19-38-37(41)45)36(44)39-30(21-28-15-7-5-8-16-28)23-32(42)31(22-29-17-9-6-10-18-29)40-33(43)24-46-35-26(3)13-11-14-27(35)4/h5-11,13-18,25,30-32,34,42H,12,19-24H2,1-4H3,(H,38,45)(H,39,44)(H,40,43)/t30-,31-,32-,34-/m0/s1",small molecule
1197,DB01602,Bacampicillin,approved|investigational,"For infections at the following sites: upper and lower respiratory tract; skin and soft tissue; urinary tract and acute uncomplicated gonococcal urethritis, when due to sensitive strains of the following organisms:  Gram-positive: streptococci (including <i>S","InChI=1S/C21H27N3O7S/c1-5-29-20(28)31-11(2)30-19(27)15-21(3,4)32-18-14(17(26)24(15)18)23-16(25)13(22)12-9-7-6-8-10-12/h6-11,13-15,18H,5,22H2,1-4H3,(H,23,25)/t11?,13-,14-,15+,18-/m1/s1",small molecule
1198,DB01603,Meticillin,approved|investigational,"Used to treat infections caused by susceptible Gram-positive bacteria, particularly beta-lactamase-producing organisms such as <i>Staphylococcus aureus</i> that would otherwise be resistant to most penicillins","InChI=1S/C17H20N2O6S/c1-17(2)12(16(22)23)19-14(21)11(15(19)26-17)18-13(20)10-8(24-3)6-5-7-9(10)25-4/h5-7,11-12,15H,1-4H3,(H,18,20)(H,22,23)/t11-,12+,15-/m1/s1",small molecule
1199,DB01604,Pivampicillin,approved,"or the treatment of respiratory tract infections (including acute bronchitis, acute exacerbations of chronic bronchitis and pneumonia); ear, nose and throat infections; gynecological infections; urinary tract infections (including acute uncomplicated gonococcal urethritis) when caused by non penicillinase-producing susceptible strains of the following organisms: gram-positive organisms, e","InChI=1S/C22H29N3O6S/c1-21(2,3)20(29)31-11-30-19(28)15-22(4,5)32-18-14(17(27)25(15)18)24-16(26)13(23)12-9-7-6-8-10-12/h6-10,13-15,18H,11,23H2,1-5H3,(H,24,26)/t13-,14-,15+,18-/m1/s1",small molecule
1200,DB01605,Pivmecillinam,approved,"Used to treat infections due to mecillinam-sensitive organisms such as urinary tract infections, salmonellosis and typhoid fever","InChI=1S/C21H33N3O5S/c1-20(2,3)19(27)29-13-28-18(26)15-21(4,5)30-17-14(16(25)24(15)17)22-12-23-10-8-6-7-9-11-23/h12,14-15,17H,6-11,13H2,1-5H3/t14-,15+,17-/m1/s1",small molecule
1201,DB01606,Tazobactam,approved,"Tazobactam is used in combination with piperacillin or ceftolozane to broaden the spectrum of piperacillin antibacterial action, treating susceptible infections","InChI=1S/C10H12N4O5S/c1-10(5-13-3-2-11-12-13)8(9(16)17)14-6(15)4-7(14)20(10,18)19/h2-3,7-8H,4-5H2,1H3,(H,16,17)/t7-,8+,10+/m1/s1",small molecule
1202,DB01607,Ticarcillin,approved|investigational|vet_approved,For the treatment of bacterial infections,"InChI=1S/C15H16N2O6S2/c1-15(2)9(14(22)23)17-11(19)8(12(17)25-15)16-10(18)7(13(20)21)6-3-4-24-5-6/h3-5,7-9,12H,1-2H3,(H,16,18)(H,20,21)(H,22,23)/t7-,8-,9+,12-/m1/s1",small molecule
1203,DB01608,Periciazine,approved|investigational,For use as adjunctive medication in some psychotic patients,"InChI=1S/C21H23N3OS/c22-15-16-6-7-21-19(14-16)24(18-4-1-2-5-20(18)26-21)11-3-10-23-12-8-17(25)9-13-23/h1-2,4-7,14,17,25H,3,8-13H2",small molecule
1204,DB01609,Deferasirox,approved|investigational,For the treatment of chronic iron overload due to blood transfusions (transfusional hemosiderosis) in patients 2 years of age and older,"InChI=1S/C21H15N3O4/c25-17-7-3-1-5-15(17)19-22-20(16-6-2-4-8-18(16)26)24(23-19)14-11-9-13(10-12-14)21(27)28/h1-12,25-26H,(H,27,28)",small molecule
1205,DB01610,Valganciclovir,approved|investigational,Valganciclovir is an antiviral medication used for the treatment of cytomegalovirus infections,"InChI=1S/C14H22N6O5/c1-7(2)9(15)13(23)24-4-8(3-21)25-6-20-5-17-10-11(20)18-14(16)19-12(10)22/h5,7-9,21H,3-4,6,15H2,1-2H3,(H3,16,18,19,22)/t8?,9-/m0/s1",small molecule
1206,DB01611,Hydroxychloroquine,approved,"Hydroxychloroquine is indicated for the prophylaxis of malaria where chloroquine resistance is not reported, treatment of uncomplicated malaria (caused by _P","InChI=1S/C18H26ClN3O/c1-3-22(11-12-23)10-4-5-14(2)21-17-8-9-20-18-13-15(19)6-7-16(17)18/h6-9,13-14,23H,3-5,10-12H2,1-2H3,(H,20,21)",small molecule
1207,DB01612,Amyl Nitrite,approved,For the rapid relief of angina pectoris,"InChI=1S/C5H11NO2/c1-2-3-4-5-8-6-7/h2-5H2,1H3",small molecule
1208,DB01613,Erythrityl tetranitrate,approved|experimental|investigational,For the prevention of angina,"InChI=1S/C4H6N4O12/c9-5(10)17-1-3(19-7(13)14)4(20-8(15)16)2-18-6(11)12/h3-4H,1-2H2/t3-,4+",small molecule
1209,DB01614,Acepromazine,experimental|vet_approved,Acepromazine was first used in humans in the 1950s as an antipsychotic agent,"InChI=1S/C19H22N2OS/c1-14(22)15-9-10-19-17(13-15)21(12-6-11-20(2)3)16-7-4-5-8-18(16)23-19/h4-5,7-10,13H,6,11-12H2,1-3H3",small molecule
1210,DB01616,Alverine,approved|investigational,Used to relieve cramps or spasms of the stomach and intestines,"InChI=1S/C20H27N/c1-2-21(17-9-15-19-11-5-3-6-12-19)18-10-16-20-13-7-4-8-14-20/h3-8,11-14H,2,9-10,15-18H2,1H3",small molecule
1211,DB01618,Molindone,approved,Molindone is used for the management of the manifestations of psychotic disorders,"InChI=1S/C16H24N2O2/c1-3-13-11(2)17-14-5-4-12(16(19)15(13)14)10-18-6-8-20-9-7-18/h12,17H,3-10H2,1-2H3",small molecule
1212,DB01619,Phenindamine,approved,"Used to treat sneezing, runny nose, itching, watery eyes, hives, rashes, itching, and other symptoms of allergies and the common cold","InChI=1S/C19H19N/c1-20-12-11-16-15-9-5-6-10-17(15)19(18(16)13-20)14-7-3-2-4-8-14/h2-10,19H,11-13H2,1H3",small molecule
1213,DB01620,Pheniramine,approved,Pheniramine is commonly used in over-the-counter products to treat seasonal allergies or cold and flu symptoms,"InChI=1S/C16H20N2/c1-18(2)13-11-15(14-8-4-3-5-9-14)16-10-6-7-12-17-16/h3-10,12,15H,11,13H2,1-2H3",small molecule
1214,DB01621,Pipotiazine,approved|investigational,For the maintenance treatment of chronic non-agitated schizophrenic patients,"InChI=1S/C24H33N3O3S2/c1-25(2)32(29,30)20-8-9-24-22(18-20)27(21-6-3-4-7-23(21)31-24)14-5-13-26-15-10-19(11-16-26)12-17-28/h3-4,6-9,18-19,28H,5,10-17H2,1-2H3",small molecule
1215,DB01623,Thiothixene,approved,For the management of schizophrenia,"InChI=1S/C23H29N3O2S2/c1-24(2)30(27,28)18-10-11-23-21(17-18)19(20-7-4-5-9-22(20)29-23)8-6-12-26-15-13-25(3)14-16-26/h4-5,7-11,17H,6,12-16H2,1-3H3/b19-8-",small molecule
1216,DB01624,Zuclopenthixol,approved|investigational,Used in the management of acute psychoses such as mania or schizophrenia,"InChI=1S/C22H25ClN2OS/c23-17-7-8-22-20(16-17)18(19-4-1-2-6-21(19)27-22)5-3-9-24-10-12-25(13-11-24)14-15-26/h1-2,4-8,16,26H,3,9-15H2/b18-5-",small molecule
1217,DB01625,Isopropamide,approved|vet_approved,"For the treatment of a wide range of gastrointestinal disorders, including such conditions as peptic ulcer, gastritis, hyperchlorhydria, functional diarrhea, irritable or spastic colon, pyloroduodenal irritability, pylorospasm, acute nonspecific gastroenteritis, biliary dyskinesia and chronic cholelithiasis, duodenitis, gastrointestinal spasm; it may also be used to treat genitourinary spasm","InChI=1S/C23H32N2O/c1-18(2)25(5,19(3)4)17-16-23(22(24)26,20-12-8-6-9-13-20)21-14-10-7-11-15-21/h6-15,18-19H,16-17H2,1-5H3,(H-,24,26)/p+1",small molecule
1218,DB01626,Pargyline,approved,For the treatment of moderate to severe hypertension,"InChI=1S/C11H13N/c1-3-9-12(2)10-11-7-5-4-6-8-11/h1,4-8H,9-10H2,2H3",small molecule
1219,DB01627,Lincomycin,approved|vet_approved,"Lincomycin is indicated for the treatment of serious bacterial infections by susceptible strains of streptococci, pneumococci, and staphylococci in patients who are allergic to penicillins or for situations in which a penicillin is deemed inappropriate","InChI=1S/C18H34N2O6S/c1-5-6-10-7-11(20(3)8-10)17(25)19-12(9(2)21)16-14(23)13(22)15(24)18(26-16)27-4/h9-16,18,21-24H,5-8H2,1-4H3,(H,19,25)/t9-,10-,11+,12-,13+,14-,15-,16-,18-/m1/s1",small molecule
1220,DB01628,Etoricoxib,approved|investigational,"For the treatment of rheumatoid arthritis, osteoarthritis, ankylosing spondylitis, chronic low back pain, acute pain and gout","InChI=1S/C18H15ClN2O2S/c1-12-3-4-14(10-20-12)18-17(9-15(19)11-21-18)13-5-7-16(8-6-13)24(2,22)23/h3-11H,1-2H3",small molecule
1221,DB01638,Sorbitol,approved,Used as a non-stimulant laxative via an oral suspension or enema,"InChI=1S/C6H14O6/c7-1-3(9)5(11)6(12)4(10)2-8/h3-12H,1-2H2/t3-,4+,5-,6-/m1/s1",small molecule
1222,DB01656,Roflumilast,approved,"Administered orally, roflumilast is indicated to reduce the risk of COPD exacerbations in patients with severe COPD associated with chronic bronchitis and a history of exacerbations","InChI=1S/C17H14Cl2F2N2O3/c18-11-6-22-7-12(19)15(11)23-16(24)10-3-4-13(26-17(20)21)14(5-10)25-8-9-1-2-9/h3-7,9,17H,1-2,8H2,(H,22,23,24)",small molecule
1223,DB01708,Prasterone,approved|investigational|nutraceutical,DHEA is taken as a supplement for a variety of unsubstantiated indications,"InChI=1S/C19H28O2/c1-18-9-7-13(20)11-12(18)3-4-14-15-5-6-17(21)19(15,2)10-8-16(14)18/h3,13-16,20H,4-11H2,1-2H3/t13-,14-,15-,16-,18-,19-/m0/s1",small molecule
1224,DB01764,Dalfopristin,approved,For the treatment of bacterial infections (usually in combination with quinupristin),"InChI=1S/C34H50N4O9S/c1-7-37(8-2)16-17-48(44,45)28-13-15-38-31(28)34(43)47-32(22(3)4)24(6)11-12-29(41)35-14-9-10-23(5)18-25(39)19-26(40)20-30-36-27(21-46-30)33(38)42/h9-12,18,21-22,24-25,28,31-32,39H,7-8,13-17,19-20H2,1-6H3,(H,35,41)/b10-9+,12-11+,23-18+/t24-,25-,28-,31-,32-/m1/s1",small molecule
1225,DB01783,Pantothenic acid,approved|nutraceutical|vet_approved,"Studied for the treatment of many uses such as treatment of testicular torsion, diabetic ulceration, wound healing, acne, obesity, diabetic peripheral polyneuropathy","InChI=1S/C9H17NO5/c1-9(2,5-11)7(14)8(15)10-4-3-6(12)13/h7,11,14H,3-5H2,1-2H3,(H,10,15)(H,12,13)/t7-/m0/s1",small molecule
1226,DB01914,D-glucose,approved|investigational|vet_approved,"Glucose pharmaceutical formulations (oral tablets, injections) are indicated for caloric supply and carbohydrate supplementation in case of nutrient deprivation","InChI=1S/C6H12O6/c7-1-3(9)5(11)6(12)4(10)2-8/h1,3-6,8-12H,2H2/t3-,4+,5+,6+/m0/s1",small molecule
1227,DB01956,Taurine,approved|nutraceutical,The use of diet supplements containing taurine is indicated for the nutritional support of infants and young pediatric patients requiring total parenteral nutrition via central or peripheral routes,"InChI=1S/C2H7NO3S/c3-1-2-7(4,5)6/h1-3H2,(H,4,5,6)",small molecule
1228,DB02300,Calcipotriol,approved,For the treatment of moderate plaque psoriasis in adults,"InChI=1S/C27H40O3/c1-17(6-13-25(29)20-8-9-20)23-11-12-24-19(5-4-14-27(23,24)3)7-10-21-15-22(28)16-26(30)18(21)2/h6-7,10,13,17,20,22-26,28-30H,2,4-5,8-9,11-12,14-16H2,1,3H3/b13-6+,19-7+,21-10-/t17-,22-,23-,24+,25-,26+,27-/m1/s1",small molecule
1229,DB02546,Vorinostat,approved|investigational,"For the treatment of cutaneous manifestations in patients with cutaneous T-cell lymphoma who have progressive, persistent or recurrent disease on or following two systemic therapies","InChI=1S/C14H20N2O3/c17-13(15-12-8-4-3-5-9-12)10-6-1-2-7-11-14(18)16-19/h3-5,8-9,19H,1-2,6-7,10-11H2,(H,15,17)(H,16,18)",small molecule
1230,DB02659,Cholic Acid,approved,"Oral cholic acid is indicated for: treatment of bile acid synthesis disorders due to single enzyme defects; and as adjunctive treatment of peroxisomal disorders including Zellweger spectrum disorders in patients who exhibit manifestations of liver disease, steatorrhea or complications from decreased fat soluble vitamin absorption","InChI=1S/C24H40O5/c1-13(4-7-21(28)29)16-5-6-17-22-18(12-20(27)24(16,17)3)23(2)9-8-15(25)10-14(23)11-19(22)26/h13-20,22,25-27H,4-12H2,1-3H3,(H,28,29)/t13-,14+,15-,16-,17+,18+,19-,20+,22+,23+,24-/m1/s1",small molecule
1231,DB02703,Fusidic acid,approved|investigational,For the treatment of bacterial infections,"InChI=1S/C31H48O6/c1-17(2)9-8-10-20(28(35)36)26-22-15-24(34)27-29(5)13-12-23(33)18(3)21(29)11-14-30(27,6)31(22,7)16-25(26)37-19(4)32/h9,18,21-25,27,33-34H,8,10-16H2,1-7H3,(H,35,36)/b26-20-/t18-,21-,22-,23+,24+,25-,27-,29-,30-,31-/m0/s1",small molecule
