,drugbank_id,name,groups,indication,smiles,type
1607,DB09099,Somatostatin,approved|investigational,For the symptomatic treatment of acute bleeding from esophageal varices,C[C@@H](O)[C@@H]1NC(=O)[C@H](CC2=CC=CC=C2)NC(=O)[C@@H](NC(=O)[C@H](CCCCN)NC(=O)[C@H](CC2=CNC3=C2C=CC=C3)NC(=O)[C@H](CC2=CC=CC=C2)NC(=O)[C@H](CC2=CC=CC=C2)NC(=O)[C@H](CC(N)=O)NC(=O)[C@H](CCCCN)NC(=O)[C@H](CSSC[C@H](NC(=O)[C@H](CO)NC1=O)C(O)=O)NC(=O)CNC(=O)[C@H](C)N)[C@@H](C)O,small molecule
1608,DB09101,Elvitegravir,approved,Elvitegravir in combination with an HIV protease inhibitor coadministered with ritonavir and with other antiretroviral drug(s) is indicated for the treatment of HIV-1 infection in antiretroviral treatment-experienced adults,[H][C@@](CO)(C(C)C)N1C=C(C(O)=O)C(=O)C2=C1C=C(OC)C(CC1=C(F)C(Cl)=CC=C1)=C2,small molecule
1609,DB09102,Daclatasvir,approved|investigational,"Indicated for use with sofosbuvir, with or without ribavirin, for the treatment of chronic HCV genotype 1a/b or 3 infection",COC(=O)N[C@@H](C(C)C)C(=O)N1CCC[C@H]1C1=NC=C(N1)C1=CC=C(C=C1)C1=CC=C(C=C1)C1=CN=C(N1)[C@@H]1CCCN1C(=O)[C@@H](NC(=O)OC)C(C)C,small molecule
1610,DB09104,Magnesium hydroxide,approved|investigational,Magnesium hydroxide can be used as an antacid or a laxative depending on the administered dose,[OH-].[OH-].[Mg++],small molecule
1611,DB09110,Coenzyme M,approved|investigational,Mesna is a uroprotective agent and is used prophylactically to reduce ifosfamide and cyclophosphamide induced hemorrhagic cystitis,OS(=O)(=O)CCS,small molecule
1612,DB09112,Nitrous acid,approved|investigational,For sequential use with sodium thiosulfate for the treatment of acute cyanide poisoning that is judged to be life-threatening [FDA Label],ON=O,small molecule
1613,DB09114,Colfosceril palmitate,approved|investigational|withdrawn,Colfosceril palmitate is indicated for the treatment of respiratory distress syndrome (RDS) in premature infants,CCCCCCCCCCCCCCCC(=O)OC[C@H](COP([O-])(=O)OCC[N+](C)(C)C)OC(=O)CCCCCCCCCCCCCCC,small molecule
1614,DB09115,Diiodohydroxyquinoline,approved,Used in the treatment of amoebiasis,OC1=C2N=CC=CC2=C(I)C=C1I,small molecule
1615,DB09116,Calcium carbimide,approved|withdrawn,Calcium carbimide has not been approved by the FDA but the intended indication is for the treatment of alcoholism,[Ca++].[N-]=C=[N-],small molecule
1616,DB09117,Paraldehyde,approved|investigational,Paraldehyde was used historically as a sedative and hypnotic [A19735],CC1OC(C)OC(C)O1,small molecule
1617,DB09118,Stiripentol,approved,"In the US, stiripentol is indicated for the treatment of seizures associated with Dravet syndrome in patients taking [clobazam] who are 6 months of age and older and weighing 7 kg or more",CC(C)(C)C(O)\C=C\C1=CC2=C(OCO2)C=C1,small molecule
1618,DB09119,Eslicarbazepine acetate,approved,Eslicarbazepine acetate is indicated for the treatment of partial-onset seizures in patients 4 years of age and older,CC(=O)O[C@H]1CC2=CC=CC=C2N(C(N)=O)C2=CC=CC=C12,small molecule
1619,DB09120,Zucapsaicin,approved|investigational,"Indicated to be used in conjunction with oral COX-2 inhibitors or NSAIDs for the relief of severe pain in adult patients with osteoarthritis of the knee, not controlled with oral COX-2 inhibitors or NSAIDs alone, for a duration of no more than three months",COC1=C(O)C=CC(CNC(=O)CCCC\C=C/C(C)C)=C1,small molecule
1620,DB09121,Aurothioglucose,approved|withdrawn,"Aurothioglucose is indicated for the adjunctive treatment of early active adult and juvenile type rheumatoid arthritis that is not adequately controlled by other anti-inflammatory agents and conservative measures like salicylate, glucocorticoids, etc",OC[C@H]1O[C@H](S[Au])[C@H](O)[C@@H](O)[C@@H]1O,small molecule
1621,DB09123,Dienogest,approved,Indicated for use as the treatment of endometriosis alone and as a contraceptive in combination with ethinylestradiol,[H][C@@]12CC[C@@](O)(CC#N)[C@@]1(C)CCC1=C3CCC(=O)C=C3CC[C@@]21[H],small molecule
1622,DB09124,Medrogestone,approved|withdrawn,"Medrogestone is indicated as adjunct to treat endometial shedding in menopausal women, to treat secondary amenorrhea, to induce menses and to treat dysfunctional uterine bleeding in adult and adolescent women",[H][C@@]12CC[C@](C)(C(C)=O)[C@@]1(C)CC[C@@]1([H])[C@@]2([H])C=C(C)C2=CC(=O)CC[C@]12C,small molecule
1623,DB09125,Potassium citrate,approved|investigational|vet_approved,"For the management of renal tubular acidosis, hypocitraturic calcium oxalate nephrolithiasis, and uric acid lithiasis with or without calcium stones",[K+].[K+].[K+].OC(CC([O-])=O)(CC([O-])=O)C([O-])=O,small molecule
1624,DB09128,Brexpiprazole,approved|investigational,Brexpiprazole is indicated as adjunctive therapy to antidepressants for the treatment of major depressive disorder in adults,O=C1NC2=CC(OCCCCN3CCN(CC3)C3=C4C=CSC4=CC=C3)=CC=C2C=C1,small molecule
1625,DB09129,Chromic chloride,approved,For use as a supplement to intravenous solutions given for total parenteral nutrition (TPN),[Cl-].[Cl-].[Cl-].[Cr+3],small molecule
1626,DB09130,Copper,approved|investigational,For use in the supplementation of total parenteral nutrition and in contraception with intrauterine devices [FDA Label] [L801],[Cu],small molecule
1627,DB09131,Cupric Chloride,approved|investigational,For use as a supplement to intravenous solutions given for total parenteral nutrition (TPN),Cl[Cu]Cl,small molecule
1628,DB09132,Gadoteric acid,approved,"Gadoteric acid is indicated for intravenous use with magnetic resonance imaging (MRI) in brain (intracranial), spine and associated tissues in adult and pediatric patients (2 years of age and older) to detect and visualize areas with disruption of the blood brain barrier (BBB) and/or abnormal vascularity",[Gd+3].OC(=O)CN1CCN(CC([O-])=O)CCN(CC([O-])=O)CCN(CC([O-])=O)CC1,small molecule
1629,DB09133,Iothalamic acid,approved,"Conray is indicated for use in excretory urography, cerebral angiography, peripheral arteriography, venography, arthrography, direct cholangiography, endoscopic retrograde cholangiopancreatography, contrast enhancement of computed tomographic brain images, cranial computerized angiotomography, intravenous digital subtraction angiography and arterial digital subtraction angiography",CNC(=O)C1=C(I)C(C(O)=O)=C(I)C(NC(C)=O)=C1I,small molecule
1630,DB09134,Ioversol,approved,"As the product Optiray 300, the intra-arterial use of ioversol is indicated for cerebral arteriography and peripheral arteriography in adults, while its intravenous use is indicated for CT imaging of the head and body, venography, and intravenous excretory urography in adults",OCCN(C(=O)CO)C1=C(I)C(C(=O)NCC(O)CO)=C(I)C(C(=O)NCC(O)CO)=C1I,small molecule
1631,DB09135,Ioxilan,approved,"When administered  intra-arterially, Ioxilan is indicated for the following diagnostic tests: cerebral arteriography (300 mgI/mL),  coronary arteriography and left ventriculography (350 mgI/mL), visceral angiography(350 mgI/mL), aortography(350 mgI/mL), and peripheral arteriography(350 mgI/mL)",CC(=O)N(CC(O)CO)C1=C(I)C(C(=O)NCC(O)CO)=C(I)C(C(=O)NCCO)=C1I,small molecule
1632,DB09136,Isosulfan blue,approved,Isosulfan Blue is a synthetic visual lymphatic imaging agent,CCN(CC)C1=CC=C(C=C1)C(=C1C=CC(C=C1)=[N+](CC)CC)C1=CC(=CC=C1S(O)(=O)=O)S(O)(=O)=O,small molecule
1633,DB09137,Technetium Tc-99m mebrofenin,approved,Technetium Tc 99m Mebrofenin is indicated as a hepatobiliary imaging agent,[Tc].CC1=CC(C)=C(Br)C(C)=C1NC(=O)CN(CC(O)=O)CC(O)=O,small molecule
1634,DB09138,Technetium Tc-99m medronate,approved,Technetium Tc 99m Medronate is indicated for use as a bone imaging agent to delineate areas of altered osteogenesis,O.O.[98Tc+4].[O-]P([O-])(=O)CP([O-])([O-])=O,small molecule
1635,DB09139,Technetium Tc-99m oxidronate,approved,Technetium Tc-99m oxidronate is indicated in adult and pediatric patients to be used in skeletal imaging for diagnosis of areas that can present altered osteogenesis,[99Tc].OC(P(O)(O)=O)P(O)(O)=O,small molecule
1636,DB09140,Oxygen,approved|vet_approved,"Oxygen therapy in clinical settings is used across diverse specialties, including various types of anoxia, hypoxia or dyspnea and any other disease states and conditions that reduce the efficiency of gas exchange and oxygen consumption such as respiratory illnesses, trauma, poisonings and drug overdoses",O=O,small molecule
1637,DB09142,Sincalide,approved,"As the product Kinevac (FDA), sincalide is used for the following indications: 1) to stimulate gallbladder contraction, as may be assessed by various methods of diagnostic imaging, or to obtain by duodenal aspiration a sample of concentrated bile for analysis of cholesterol, bile salts, phospholipids, and crystals; (2) to stimulate pancreatic secretion (especially in conjunction with secretin) prior to obtaining a duodenal aspirate for analysis of enzyme activity, composition, and cytology; (3) to accelerate the transit of a barium meal through the small bowel, thereby decreasing the time and extent of radiation associated with fluoroscopy and x-ray examination of the intestinal tract",CSCC[C@H](NC(=O)[C@H](CC1=CC=C(OS(O)(=O)=O)C=C1)NC(=O)[C@@H](N)CC(O)=O)C(=O)NCC(=O)N[C@@H](CC1=CNC2=CC=CC=C12)C(=O)N[C@@H](CCSC)C(=O)N[C@@H](CC(O)=O)C(=O)N[C@@H](CC1=CC=CC=C1)C(N)=O,small molecule
1638,DB09143,Sonidegib,approved|investigational,Sonidegib is approved for use in the US and EU for treatment of adults with locally advanced basal cell carcinoma (BCC) that has recurred post surgery or radiation therapy,[H][C@]1(C)CN(C[C@@]([H])(C)O1)C1=CC=C(NC(=O)C2=CC=CC(=C2C)C2=CC=C(OC(F)(F)F)C=C2)C=N1,small molecule
1639,DB09144,Uridine triacetate,approved|investigational,"Marketed as the product Xuriden (FDA), uridine triacetate is indicated for the treatment of hereditary orotic aciduria",CC(=O)OC[C@H]1O[C@H]([C@H](OC(C)=O)[C@@H]1OC(C)=O)N1C=CC(=O)NC1=O,small molecule
1640,DB09145,Water,approved,"For diluting or dissolving drugs for intravenous, intramuscular or subcutaneous injection, according to instructions of the manufacturer of the drug to be administered [FDA Label]",O,small molecule
1641,DB09146,Iron sucrose,approved,Iron sucrose is elemental iron as an injection,O.O.O.[OH-].[O--].[O--].[O--].[O--].[O--].[O--].[O--].[O--].[Na+].[Na+].[Fe+3].[Fe+3].[Fe+3].[Fe+3].[Fe+3].OC[C@H]1O[C@@](CO)(O[C@H]2O[C@H](CO)[C@@H](O)[C@H](O)[C@H]2O)[C@@H](O)[C@@H]1O,small molecule
1642,DB09148,Florbetaben (18F),approved,Florbetaben is a radioactive diagnostic agent indicated for Positron Emission Tomography (PET) imaging of the brain to estimate β-amyloid neuritic plaque density in adult patients with cognitive impairment who are being evaluated for Alzheimer’s Disease (AD) and other causes of cognitive decline,CNC1=CC=C(\C=C\C2=CC=C(OCCOCCOCC[18F])C=C2)C=C1,small molecule
1643,DB09149,Florbetapir (18F),approved|investigational,Florbetapir 18F is indicated for Positron Emission Tomography (PET) imaging of the brain to estimate β-amyloid neuritic plaque density in adult patients with cognitive impairment who are being evaluated for Alzheimer's Disease (AD) and other causes of cognitive decline,[H]N(C1=C([H])C([H])=C(\C([H])=C(/[H])C2=C([H])N=C(OC([H])([H])C([H])([H])OC([H])([H])C([H])([H])OC([H])([H])C([H])([H])[18F])C([H])=C2[H])C([H])=C1[H])C([H])([H])[H],small molecule
1644,DB09151,Flutemetamol (18F),approved|investigational,Flutemetamol F18 is indicated for Positron Emission Tomography (PET) imaging of the brain to estimate β amyloid neuritic plaque density in adult patients with cognitive impairment who are being evaluated for Alzheimer's disease (AD) or other causes of cognitive decline,CNC1=C([18F])C=C(C=C1)C1=NC2=CC=C(O)C=C2S1,small molecule
1645,DB09152,Nitrogen,approved|vet_approved,Liquid nitrogen is used mainly as a cryogenic agent for the treatment of various benign and malignant skin lesions,N#N,small molecule
1646,DB09153,Sodium chloride,approved|vet_approved,This intravenous solution is indicated for use in adults and pediatric patients as a source of electrolytes and water for hydration,[Na+].[Cl-],small molecule
1647,DB09154,Sodium citrate,approved|investigational,Used as an anticoagulant during plasmophoresis as well as a neutralizing agent in the treatment of upset stomach and acidic urine [FDA Label] [L788] [L789],[Na+].[Na+].[Na+].OC(CC([O-])=O)(CC([O-])=O)C([O-])=O,small molecule
1648,DB09155,Helium,approved|investigational|vet_approved,For use in patients who are not getting enough oxygen into their blood due to blockages in the lungs from pathological conditions or injuries,[He],small molecule
1649,DB09156,Iopromide,approved,"Iopromide, as the product Iovist, is indicated for use as an X-ray contrast agent in the following procedures:
Intra-arterial digital subtraction angiography (IA-DSA) (150 mg I/mL) 
Cerebral arteriography and peripheral arteriography (300 mg I/mL) 
Coronary arteriography and left ventriculography, visceral angiography and aortography (370 mg I/mL) 
Peripheral venography (240 mg I/mL) 
Excretory urography (300 mg I/mL)
Contrast computed tomography (CT) imaging of head and body (300 mg I/mL and 370 mg I/mL) ",COCC(=O)NC1=C(I)C(C(=O)N(C)CC(O)CO)=C(I)C(C(=O)NCC(O)CO)=C1I,small molecule
1650,DB09157,Carbon dioxide,approved|investigational|vet_approved,"Carbon dioxide is commonly used as an insufflation gas for minimal invasive surgery (laparoscopy, endoscopy, and arthroscopy) to enlarge and stabilize body cavities to provide better visibility of the surgical area",O=C=O,small molecule
1651,DB09158,Trypan blue free acid,approved,"Trypan blue is indicated for use as an aid in ophthalmic surgery by staining the epiretinal membranes during ophthalmic surgical vitrectomy procedures, facilitating removal of the tissue",CC1=CC(=CC=C1\N=N\C1=C(C=C2C=C(C=C(N)C2=C1O)S(O)(=O)=O)S(O)(=O)=O)C1=CC(C)=C(C=C1)\N=N\C1=C(O)C2=C(N)C=C(C=C2C=C1S(O)(=O)=O)S(O)(=O)=O,small molecule
1652,DB09160,Technetium Tc-99m tetrofosmin,approved,Technetium-99m tetrofosmin is indicated for the diagnosis of heart abnormalities by exercise myocardial scintigraphy,O.O.[98Tc].CCOCCP(CCOCC)CCP(CCOCC)CCOCC.CCOCCP(CCOCC)CCP(CCOCC)CCOCC,small molecule
1653,DB09161,Technetium Tc-99m sestamibi,approved|investigational,Technetium Tc 99m Sestamibi is indicated for: 1) detecting coronary artery disease by localizing myocardial ischemia (reversible defects) and infarction (non-reversible defects); and 2) evaluating myocardial function and developing information for use in patient management decisions,[Tc+].COC(C)(C)C[N+]#[C-].COC(C)(C)C[N+]#[C-].COC(C)(C)C[N+]#[C-].COC(C)(C)C[N+]#[C-].COC(C)(C)C[N+]#[C-].COC(C)(C)C[N+]#[C-],small molecule
1654,DB09164,Technetium Tc-99m disofenin,approved,Technetium Tc99m Disofenin is indicated as a hepatobiliary imaging agent,[99Tc].CC(C)C1=CC=CC(C(C)C)=C1NC(=O)CN(CC(O)=O)CC(O)=O,small molecule
1655,DB09165,Technetium Tc-99m pyrophosphate,approved,"For use as a skeletal imaging agent used to demonstrate areas of altered osteogenesis, and a cardiac imaging agent used as an adjunct in the diagnosis of acute myocardial infarction [FDA Label]",[99Tc+4].[O-]P([O-])(=O)OP([O-])([O-])=O,small molecule
1656,DB09167,Dosulepin,approved,"Indicated in the treatment of symptoms of depressive illness, especially where an anti-anxiety effect is required",CN(C)CC\C=C1/C2=CC=CC=C2CSC2=CC=CC=C12,small molecule
1657,DB09183,Dasabuvir,approved,"Dasabuvir, in combination with [DB09296], [DB09297], and [DB00503] (as Viekira Pak) is indicated for the treatment of patients with HCV genotype 1a with [DB00811] or genotype 1b without [DB00811] including those with compensated cirrhosis [FDA Label]",COC1=C(C=C(C=C1C1=CC2=CC=C(NS(C)(=O)=O)C=C2C=C1)N1C=CC(=O)NC1=O)C(C)(C)C,small molecule
1658,DB09185,Viloxazine,approved|investigational|withdrawn,Viloxazine is a selective norepinephrine reuptake inhibitor indicated for the treatment of Attention Deficit Hyperactivity Disorder (ADHD) in adults and pediatric patients 6 years and older,CCOC1=CC=CC=C1OCC1CNCCO1,small molecule
1659,DB09195,Lorpiprazole,approved,"In 2016, lorpiprazole was classified in the ""Chemical structure-related drug-like criteria of global approved drugs"" as an antipsychotic and anxiolytic",[H][C@@]12CCC[C@]1([H])C1=NN=C(CCN3CCN(CC3)C3=CC=CC(=C3)C(F)(F)F)N1C2,small molecule
1660,DB09205,Moxisylyte,approved|investigational,"By the WHO, moxisylyte is indicated for the symptomatic management of sequelae of cerebral infarction or hemorrhage",CC(C)C1=C(OCCN(C)C)C=C(C)C(OC(C)=O)=C1,small molecule
1661,DB09209,Pholcodine,approved|illicit,Pholcodine is indicated as a cough suppressant for the temporary relief of non-productive dry cough,[H][C@@]12OC3=C(OCCN4CCOCC4)C=CC4=C3[C@@]11CCN(C)[C@]([H])(C4)[C@]1([H])C=C[C@@H]2O,small molecule
1662,DB09210,Piracetam,approved|investigational,"Indicated in adult patients suffering from myoclonus of cortical origin, irrespective of aetiology, and should be used in combination with other anti-myoclonic therapies [L1125]",NC(=O)CN1CCCC1=O,small molecule
1663,DB09212,Loxoprofen,approved,Loxoprofen is non-steroidal anti-inflammatory medication (NSAID) indicated for pain and inflammation related to musculoskeletal and joint disorders,CC(C(O)=O)C1=CC=C(CC2CCCC2=O)C=C1,small molecule
1664,DB09213,Dexibuprofen,approved|investigational,"For more information, refer to [ibuprofen]",CC(C)CC1=CC=C(C=C1)[C@H](C)C(O)=O,small molecule
1665,DB09214,Dexketoprofen,approved|investigational,"For short-term treatment of mild to moderate pain, including dysmenorrhoea, musculoskeletal pain and toothache [L1302]",[H][C@@](C)(C(O)=O)C1=CC(=CC=C1)C(=O)C1=CC=CC=C1,small molecule
1666,DB09216,Tolfenamic acid,approved|investigational,"In the information for tolfenamic acid, it is stated that this drug, being an NSAID, is effective in treating the pain associated with the acute attack of migraines in adults",CC1=C(Cl)C=CC=C1NC1=CC=CC=C1C(O)=O,small molecule
1667,DB09217,Firocoxib,experimental|vet_approved,Used for the treatment of pain inflammation and fever in horses and dogs,CC1(C)OC(=O)C(OCC2CC2)=C1C1=CC=C(C=C1)S(C)(=O)=O,small molecule
1668,DB09219,Bisoxatin,approved,For use in the treatment of constipation in the absence of bowel obstruction and for surgical preparation of the colon [L926],OC1=CC=C(C=C1)C1(OC2=CC=CC=C2NC1=O)C1=CC=C(O)C=C1,small molecule
1669,DB09220,Nicorandil,approved|investigational,Indicated for the prevention and treatment of chronic stable angina pectoris and reduction in the risk of acute coronary syndromes,[O-][N+](=O)OCCNC(=O)C1=CC=CN=C1,small molecule
1670,DB09225,Zotepine,approved|investigational|withdrawn,"Zotepine, like other atypical antipsychotics, is considered as the first-line treatment in newly diagnosed schizophrenia",CN(C)CCOC1=CC2=CC=CC=C2SC2=CC=C(Cl)C=C12,small molecule
1671,DB09236,Lacidipine,approved|investigational,"Indicated for the treatment of hypertension either alone or in combination with other antihypertensive agents, including β-adrenoceptor antagonists, diuretics, and ACE-inhibitors [L1126]",CCOC(=O)C1=C(C)NC(C)=C(C1C1=CC=CC=C1\C=C\C(=O)OC(C)(C)C)C(=O)OCC,small molecule
1672,DB09237,Levamlodipine,approved|investigational,Levamlodipine is indicated alone or in combination to treat hypertension in adults and children,CCOC(=O)C1=C(COCCN)NC(C)=C([C@@H]1C1=CC=CC=C1Cl)C(=O)OC,small molecule
1673,DB09238,Manidipine,approved|investigational,For the treatment of hypertension,COC(=O)C1=C(C)NC(C)=C(C1C1=CC(=CC=C1)N(=O)=O)C(=O)OCCN1CCN(CC1)C(C1=CC=CC=C1)C1=CC=CC=C1,small molecule
1674,DB09241,Methylene blue,approved|investigational,Indicated for the treatment of pediatric and adult patients with acquired methemoglobinemia,[Cl-].CN(C)C1=CC2=[S+]C3=C(C=CC(=C3)N(C)C)N=C2C=C1,small molecule
1675,DB09242,Moxonidine,approved|investigational,For the treatment of mild to moderate essential or primary hypertension [L1025],COC1=NC(C)=NC(Cl)=C1NC1=NCCN1,small molecule
1676,DB09256,Tegafur,approved|investigational,Indicated for the treatment of cancer usually in combination with other biochemically modulating drugs,FC1=CN(C2CCCO2)C(=O)NC1=O,small molecule
1677,DB09257,Gimeracil,approved,Gimeracil is used as an adjunct to antineoplastic therapy,OC1=CC(=O)NC=C1Cl,small molecule
1678,DB09267,Strontium ranelate,approved|withdrawn,"Strontium ranelate is therapeutically indicated for the treatment of severe osteoperosis in: a) postmenopasual women, and b) adult men, who are at high risk of fractures, for whom treatment with other medical products approved for the treatment of osteoperosis is not possible due to, for example, contraindications or intolerance",[Sr++].[Sr++].[O-]C(=O)CN(CC([O-])=O)C1=C(C#N)C(CC([O-])=O)=C(S1)C([O-])=O,small molecule
1679,DB09268,Picosulfuric acid,approved,"Sodium picosulfate, in combination with magnesium oxide and anhydrous citric acid, is indicated for cleansing of the colon as a preparation for colonoscopy in adults and pediatric patients ages 9 years and older",OS(=O)(=O)OC1=CC=C(C=C1)C(C1=CC=C(OS(O)(=O)=O)C=C1)C1=CC=CC=N1,small molecule
1680,DB09269,Phenylacetic acid,approved,For use as adjunctive therapy for the treatment of acute hyperammonemia and associated encephalopathy in patients with deficiencies in enzymes of the urea cycle,OC(=O)CC1=CC=CC=C1,small molecule
1681,DB09270,Ubidecarenone,approved|investigational|nutraceutical,"The diet supplements containing ubidecarenone are indicated, as stated in the product label, to assist individuals with cardiovascular complaints including congestive heart failure and systolic hypertension",COC1=C(OC)C(=O)C(C\C=C(/C)CC\C=C(/C)CC\C=C(/C)CC\C=C(/C)CC\C=C(/C)CC\C=C(/C)CC\C=C(/C)CC\C=C(/C)CC\C=C(/C)CCC=C(C)C)=C(C)C1=O,small molecule
1682,DB09272,Eluxadoline,approved|investigational,For the treatment of irritable bowel syndrome with diarrhea (IBS-D),COC1=CC=C(CN([C@@H](C)C2=NC(=CN2)C2=CC=CC=C2)C(=O)[C@@H](N)CC2=C(C)C=C(C=C2C)C(N)=O)C=C1C(O)=O,small molecule
1683,DB09274,Artesunate,approved|investigational,Artesunate is indicated for the initial treatment of severe malaria in adult and pediatric patients,[H][C@@]12CC[C@@H](C)[C@]3([H])CC[C@@]4(C)OO[C@@]13[C@]([H])(O[C@@H](OC(=O)CCC(O)=O)[C@@H]2C)O4,small molecule
1684,DB09275,Bismuth subcitrate potassium,approved|investigational,For the treatment of peptic ulcer and gastro-oesophageal reflux disease (GORD),[K+].[K+].[K+].[K+].[K+].[Bi+3].[O-]C(=O)CC([O-])(CC([O-])=O)C([O-])=O.[O-]C(=O)CC([O-])(CC([O-])=O)C([O-])=O,small molecule
1685,DB09276,Sodium aurothiomalate,approved|investigational,A disease-modifying antirheumatic drug (DMARD) indicated for the symptomatic treatment of arthritis,[Na+].[Na+].[O-]C(=O)CC(S[Au])C([O-])=O,small molecule
1686,DB09277,Choline C 11,approved|investigational,"Choline C11 is indicated for its use in positron emission tomography (PET) imaging in patients with suspected prostate cancer recurrence and non-informative bone scintigraphy, computerized tomography or magnetic resonance imaging",[Cl-].C[N+](C)([11CH3])CCO,small molecule
1687,DB09278,Activated charcoal,approved,Used as a antidote to treat poisonings following excessive oral ingestion of certain medications or poisons,[C],small molecule
1688,DB09280,Lumacaftor,approved,"When used in combination with the drug [lumacaftor] as the product Orkambi, ivacaftor is indicated for the management of CF in patients aged one year and older who are homozygous for the _F508del_ mutation in the CFTR gene",CC1=CC=C(NC(=O)C2(CC2)C2=CC=C3OC(F)(F)OC3=C2)N=C1C1=CC(=CC=C1)C(O)=O,small molecule
1689,DB09281,Magnesium trisilicate,approved,For the treatment of peptic ulcers,[Mg++].[Mg++].[O-][Si](=O)O[Si]([O-])([O-])O[Si]([O-])=O,small molecule
1690,DB09282,Molsidomine,approved|investigational,"The indications for use of molsidomine include ischemic heart disease, angina, chronic heart failure, and pulmonary hypertension [L1370, L1371]",CCOC(=O)[N-]C1=C[N+](=NO1)N1CCOCC1,small molecule
1691,DB09291,Rolapitant,approved|investigational,This drug is indicated in adults in combination with other antiemetics for the prevention of delayed nausea and vomiting associated with emetogenic chemotherapy,C[C@@H](OC[C@]1(CC[C@]2(CCC(=O)N2)CN1)C1=CC=CC=C1)C1=CC(=CC(=C1)C(F)(F)F)C(F)(F)F,small molecule
1692,DB09292,Sacubitril,approved,Used in combination with valsartan to reduce the risk of cardiovascular events in patients with chronic heart failure (NYHA Class II-IV) and reduced ejection fraction,CCOC(=O)[C@H](C)C[C@@H](CC1=CC=C(C=C1)C1=CC=CC=C1)NC(=O)CCC(O)=O,small molecule
1693,DB09293,Iodide I-131,approved|investigational,Therapeutic solutions of Sodium Iodide-131 are indicated for the treatment of hyperthyroidism and thyroid carcinomas that take up iodine,[131I-],small molecule
1694,DB09296,Ombitasvir,approved|investigational,"When used in combination with [DB09297] and [DB00503] (as the fixed dose product Technivie), Ombitasvir is indicated in combination with [DB00811] for the treatment of patients with genotype 4 chronic hepatitis C virus (HCV) infection without cirrhosis [L866]",COC(=O)N[C@@H](C(C)C)C(=O)N1CCC[C@H]1C(=O)NC1=CC=C(C=C1)[C@@H]1CC[C@H](N1C1=CC=C(C=C1)C(C)(C)C)C1=CC=C(NC(=O)[C@@H]2CCCN2C(=O)[C@@H](NC(=O)OC)C(C)C)C=C1,small molecule
1695,DB09297,Paritaprevir,approved|investigational,"When used within the fixed-dose combination product with [DB09296], [DB09183], and [DB00503] as the FDA-approved product Viekira Pak, paritaprevir is indicated for the treatment of HCV genotype 1b without cirrhosis or with compensated cirrhosis, and when combined with [DB00811] for the treatment of HCV genotype 1a without cirrhosis or with compensated cirrhosis",[H][C@@]12C[C@]1(NC(=O)[C@]1([H])C[C@H](CN1C(=O)[C@H](CCCCC\C=C/2)NC(=O)C1=CN=C(C)C=N1)OC1=NC2=C(C=CC=C2)C2=C1C=CC=C2)C(=O)NS(=O)(=O)C1CC1,small molecule
1696,DB09299,Tenofovir alafenamide,approved,Tenofovir alafenamide is indicated for the treatment of hepatitis B virus infection in adults and pediatric patients 12 years of age and older with compensated liver disease,CC(C)OC(=O)[C@H](C)N[P@](=O)(CO[C@H](C)CN1C=NC2=C(N)N=CN=C12)OC1=CC=CC=C1,small molecule
