,drugbank_id,name,groups,indication,inchi,type
566,DB00711,Diethylcarbamazine,approved|investigational|vet_approved,"Used for the treatment of certain filarial diseases, including tropical pulmonary eosinophilia, loiasis, and lymphatic filariasis caused by infection with <i>Wuchereria bancrofti</i>, <i>Brugia malayi</i>, or <i>Brugia timori</i>","InChI=1S/C10H21N3O/c1-4-12(5-2)10(14)13-8-6-11(3)7-9-13/h4-9H2,1-3H3",small molecule
567,DB00712,Flurbiprofen,approved|investigational,"Flurbiprofen tablets are indicated for the acute or long-term symptomatic treatment of rheumatoid arthritis, osteorarthritis and anklosing spondylitis","InChI=1S/C15H13FO2/c1-10(15(17)18)12-7-8-13(14(16)9-12)11-5-3-2-4-6-11/h2-10H,1H3,(H,17,18)",small molecule
568,DB00713,Oxacillin,approved|investigational,Used in the treatment of resistant staphylococci infections,"InChI=1S/C19H19N3O5S/c1-9-11(12(21-27-9)10-7-5-4-6-8-10)15(23)20-13-16(24)22-14(18(25)26)19(2,3)28-17(13)22/h4-8,13-14,17H,1-3H3,(H,20,23)(H,25,26)/t13-,14+,17-/m1/s1",small molecule
569,DB00714,Apomorphine,approved|investigational,"Apomorphine is indicated to treat acute, intermittent treatment of hypomobility, off episodes associated with advanced Parkinson's disease","InChI=1S/C17H17NO2/c1-18-8-7-10-3-2-4-12-15(10)13(18)9-11-5-6-14(19)17(20)16(11)12/h2-6,13,19-20H,7-9H2,1H3/t13-/m1/s1",small molecule
570,DB00715,Paroxetine,approved|investigational,"Paroxetine is indicated for the management of depression, obsessive-compulsive disorder, panic disorder, social anxiety disorder, generalized anxiety disorder, posttraumatic stress disorder","InChI=1S/C19H20FNO3/c20-15-3-1-13(2-4-15)17-7-8-21-10-14(17)11-22-16-5-6-18-19(9-16)24-12-23-18/h1-6,9,14,17,21H,7-8,10-12H2/t14-,17-/m0/s1",small molecule
571,DB00716,Nedocromil,approved|investigational,For the treatment of mild to moderate asthma,"InChI=1S/C19H17NO7/c1-3-5-9-16-10(13(21)7-12(18(23)24)20(16)4-2)6-11-14(22)8-15(19(25)26)27-17(9)11/h6-8H,3-5H2,1-2H3,(H,23,24)(H,25,26)",small molecule
572,DB00717,Norethisterone,approved,"Norethisterone is indicated as an oral contraceptive when given as monotherapy[L9527] or in combination with an estrogen component, such as [ethinylestradiol] or [estradiol]","InChI=1S/C20H26O2/c1-3-20(22)11-9-18-17-6-4-13-12-14(21)5-7-15(13)16(17)8-10-19(18,20)2/h1,12,15-18,22H,4-11H2,2H3/t15-,16+,17+,18-,19-,20-/m0/s1",small molecule
573,DB00718,Adefovir dipivoxil,approved|investigational,"Indicated for the treatment of chronic hepatitis B in adult patients with evidence of active viral replication and either evidence of persistent elevations in serum aminotransferases (ALT or AST) or histologically active disease; this is based on histological, virological, biochemical, and serological responses in adult patients with HBeAg+ and HBeAg- chronic hepatitis B with compensated liver function, and in adult patients with clinical evidence of lamivudine-resistant hepatitis B virus with either compensated or decompensated liver function","InChI=1S/C20H32N5O8P/c1-19(2,3)17(26)30-11-32-34(28,33-12-31-18(27)20(4,5)6)13-29-8-7-25-10-24-14-15(21)22-9-23-16(14)25/h9-10H,7-8,11-13H2,1-6H3,(H2,21,22,23)",small molecule
574,DB00719,Azatadine,approved,"For the relief of the symptoms of upper respiratory mucosal congestion in perennial and allergic rhinitis, and for the relief of nasal congestion and eustachian t","InChI=1S/C20H22N2/c1-22-13-10-16(11-14-22)19-18-7-3-2-5-15(18)8-9-17-6-4-12-21-20(17)19/h2-7,12H,8-11,13-14H2,1H3",small molecule
575,DB00720,Clodronic acid,approved|investigational|vet_approved,Clodronic acid is indicated as an adjunct in the management of osteolysis from bone metastases of malignant tumors and for management of hypercalcemia of malignancy,"InChI=1S/CH4Cl2O6P2/c2-1(3,10(4,5)6)11(7,8)9/h(H2,4,5,6)(H2,7,8,9)",small molecule
576,DB00721,Procaine,approved|investigational|vet_approved,Used as a local anesthetic primarily in oral surgery,"InChI=1S/C13H20N2O2/c1-3-15(4-2)9-10-17-13(16)11-5-7-12(14)8-6-11/h5-8H,3-4,9-10,14H2,1-2H3",small molecule
577,DB00722,Lisinopril,approved|investigational,"Lisinopril is indicated for the treatment of acute myocardial infarction, hypertension in patients 6 years, and as an adjunct therapy for heart failure","InChI=1S/C21H31N3O5/c22-13-5-4-9-16(19(25)24-14-6-10-18(24)21(28)29)23-17(20(26)27)12-11-15-7-2-1-3-8-15/h1-3,7-8,16-18,23H,4-6,9-14,22H2,(H,26,27)(H,28,29)/t16-,17-,18-/m0/s1",small molecule
578,DB00723,Methoxamine,approved|investigational,Indicated for the treatment and management of hypotension,"InChI=1S/C11H17NO3/c1-7(12)11(13)9-6-8(14-2)4-5-10(9)15-3/h4-7,11,13H,12H2,1-3H3",small molecule
579,DB00724,Imiquimod,approved|investigational,"For the topical treatment of clinically typical, nonhyperkeratotic, nonhypertrophic actinic keratoses on the face or scalp in immunocompetent adults","InChI=1S/C14H16N4/c1-9(2)7-18-8-16-12-13(18)10-5-3-4-6-11(10)17-14(12)15/h3-6,8-9H,7H2,1-2H3,(H2,15,17)",small molecule
580,DB00725,Homatropine methylbromide,approved,"Used in conjunction with antacids or histamine H2-receptor antagonists in the treatment of peptic ulcers, gastric ulcers and duodenal ulcers, to reduce further gastric acid secretion and delay gastric emptying","InChI=1S/C17H24NO3.BrH/c1-18(2)13-8-9-14(18)11-15(10-13)21-17(20)16(19)12-6-4-3-5-7-12;/h3-7,13-16,19H,8-11H2,1-2H3;1H/q+1;/p-1",small molecule
581,DB00726,Trimipramine,approved,"For the treatment of depression and depression accompanied by anxiety, agitation or sleep disturbance","InChI=1S/C20H26N2/c1-16(14-21(2)3)15-22-19-10-6-4-8-17(19)12-13-18-9-5-7-11-20(18)22/h4-11,16H,12-15H2,1-3H3",small molecule
582,DB00727,Nitroglycerin,approved|investigational,Sublingual nitroglycerin is indicated for the acute relief of an attack or acute prophylaxis of angina pectoris due to coronary artery disease,"InChI=1S/C3H5N3O9/c7-4(8)13-1-3(15-6(11)12)2-14-5(9)10/h3H,1-2H2",small molecule
583,DB00728,Rocuronium,approved,"For inpatients and outpatients as an adjunct to general anesthesia to facilitate both rapid sequence and routine tracheal intubation, and to provide skeletal muscle relaxation during surgery or mechanical ventilation","InChI=1S/C32H53N2O4/c1-5-14-34(15-6-7-16-34)28-20-26-24-9-8-23-19-29(36)27(33-12-17-37-18-13-33)21-32(23,4)25(24)10-11-31(26,3)30(28)38-22(2)35/h5,23-30,36H,1,6-21H2,2-4H3/q+1/t23-,24+,25-,26-,27-,28-,29-,30-,31-,32-/m0/s1",small molecule
584,DB00730,Thiabendazole,approved|vet_approved,"For the treatment of strongyloidiasis (threadworm), cutaneous larva migrans (creeping eruption), visceral larva migrans, and trichinosis","InChI=1S/C10H7N3S/c1-2-4-8-7(3-1)12-10(13-8)9-5-14-6-11-9/h1-6H,(H,12,13)",small molecule
585,DB00731,Nateglinide,approved|investigational,For the treatment of non-insulin dependent-diabetes mellitus in conjunction with diet and exercise,"InChI=1S/C19H27NO3/c1-13(2)15-8-10-16(11-9-15)18(21)20-17(19(22)23)12-14-6-4-3-5-7-14/h3-7,13,15-17H,8-12H2,1-2H3,(H,20,21)(H,22,23)/t15-,16-,17-/m1/s1",small molecule
586,DB00732,Atracurium besylate,approved,"For use, as an adjunct to general anesthesia, to facilitate endotracheal intubation and to provide skeletal muscle relaxation during surgery or mechanical ventilation","InChI=1S/C53H72N2O12.2C6H6O3S/c1-54(22-18-38-32-48(62-7)50(64-9)34-40(38)42(54)28-36-14-16-44(58-3)46(30-36)60-5)24-20-52(56)66-26-12-11-13-27-67-53(57)21-25-55(2)23-19-39-33-49(63-8)51(65-10)35-41(39)43(55)29-37-15-17-45(59-4)47(31-37)61-6;2*7-10(8,9)6-4-2-1-3-5-6/h14-17,30-35,42-43H,11-13,18-29H2,1-10H3;2*1-5H,(H,7,8,9)/q+2;;/p-2",small molecule
587,DB00733,Pralidoxime,approved|vet_approved,For the treatment of poisoning due to those pesticides and chemicals of the organophosphate class which have anticholinesterase activity and in the control of overdosage by anticholinesterase drugs used in the treatment of myasthenia gravis,"InChI=1S/C7H8N2O/c1-9-5-3-2-4-7(9)6-8-10/h2-6H,1H3/p+1",small molecule
588,DB00734,Risperidone,approved|investigational,Risperidone is indicated for the treatment of schizophrenia and irritability associated with autistic disorder,"InChI=1S/C23H27FN4O2/c1-15-18(23(29)28-10-3-2-4-21(28)25-15)9-13-27-11-7-16(8-12-27)22-19-6-5-17(24)14-20(19)30-26-22/h5-6,14,16H,2-4,7-13H2,1H3",small molecule
589,DB00735,Naftifine,approved,"For the topical treatment of tinea pedis, tinea cruris, and tinea corporis caused by the organisms <i>Trichophyton rubrum</i>, <i>Trichophyton mentagrophytes</i>, <i>Trichophyton tonsurans</i> and <i>Epidermophyton floccosum</i>","InChI=1S/C21H21N/c1-22(16-8-11-18-9-3-2-4-10-18)17-20-14-7-13-19-12-5-6-15-21(19)20/h2-15H,16-17H2,1H3/b11-8+",small molecule
590,DB00736,Esomeprazole,approved|investigational,"Esomeprazole is indicated for the treatment of acid-reflux disorders including healing and maintenance of erosive esophagitis, and symptomatic gastroesophageal reflux disease (GERD), peptic ulcer disease, H","InChI=1S/C17H19N3O3S/c1-10-8-18-15(11(2)16(10)23-4)9-24(21)17-19-13-6-5-12(22-3)7-14(13)20-17/h5-8H,9H2,1-4H3,(H,19,20)/t24-/m0/s1",small molecule
591,DB00737,Meclizine,approved,"Indicated for the symptomatic treatment of nausea, vomiting, and dizziness associated with motion sickness,[L6772] and management of vertigo due to various causes, including radiation sickness, Menieres syndrome, labyrinthitis and other vestibular disturbances","InChI=1S/C25H27ClN2/c1-20-6-5-7-21(18-20)19-27-14-16-28(17-15-27)25(22-8-3-2-4-9-22)23-10-12-24(26)13-11-23/h2-13,18,25H,14-17,19H2,1H3",small molecule
592,DB00738,Pentamidine,approved|investigational,For the treatment of pneumonia due to <i>Pneumocystis carinii</i>,"InChI=1S/C19H24N4O2/c20-18(21)14-4-8-16(9-5-14)24-12-2-1-3-13-25-17-10-6-15(7-11-17)19(22)23/h4-11H,1-3,12-13H2,(H3,20,21)(H3,22,23)",small molecule
593,DB00739,Hetacillin,approved|vet_approved|withdrawn,Hetacillin is a beta-lactam antibiotic prodrug used to treat bacterial infections,"InChI=1S/C19H23N3O4S/c1-18(2)13(17(25)26)21-15(24)12(16(21)27-18)22-14(23)11(20-19(22,3)4)10-8-6-5-7-9-10/h5-9,11-13,16,20H,1-4H3,(H,25,26)/t11-,12-,13+,16-/m1/s1",small molecule
594,DB00740,Riluzole,approved|investigational,"For the treatment of amyotrophic lateral sclerosis (ALS, Lou Gehrig's Disease)","InChI=1S/C8H5F3N2OS/c9-8(10,11)14-4-1-2-5-6(3-4)15-7(12)13-5/h1-3H,(H2,12,13)",small molecule
595,DB00741,Hydrocortisone,approved|vet_approved,Otic solutions are indicated for infections of the external auditory canal caused by susceptible organisms and with inflammation,"InChI=1S/C21H30O5/c1-19-7-5-13(23)9-12(19)3-4-14-15-6-8-21(26,17(25)11-22)20(15,2)10-16(24)18(14)19/h9,14-16,18,22,24,26H,3-8,10-11H2,1-2H3/t14-,15-,16-,18+,19-,20-,21-/m0/s1",small molecule
596,DB00742,Mannitol,approved|investigational,"Used for the promotion of diuresis before irreversible renal failure becomes established, the reduction of intracranial pressure, the treatment of cerebral edema, and the promotion of urinary excretion of toxic substances","InChI=1S/C6H14O6/c7-1-3(9)5(11)6(12)4(10)2-8/h3-12H,1-2H2/t3-,4-,5-,6-/m1/s1",small molecule
597,DB00743,Gadobenic acid,approved|investigational,"Gadobenate dimeglumine is indicated for use in magnetic resonance imaging (MRI) of the central nervous system in adult and pediatric patients in order to visualize lesions with abnormal blood-brain barrier or abnormal vascularity of the brain, spine, and associated tissues","InChI=1S/C22H31N3O11.Gd/c26-18(27)10-23(6-7-24(11-19(28)29)12-20(30)31)8-9-25(13-21(32)33)17(22(34)35)15-36-14-16-4-2-1-3-5-16;/h1-5,17H,6-15H2,(H,26,27)(H,28,29)(H,30,31)(H,32,33)(H,34,35);/q;+3/p-3",small molecule
598,DB00744,Zileuton,approved|investigational|withdrawn,For the prophylaxis and chronic treatment of asthma in adults and children 12 years of age and older,"InChI=1S/C11H12N2O2S/c1-7(13(15)11(12)14)10-6-8-4-2-3-5-9(8)16-10/h2-7,15H,1H3,(H2,12,14)",small molecule
599,DB00745,Modafinil,approved|investigational,To improve wakefulness in patients with excessive daytime sleepiness (EDS) associated with narcolepsy,"InChI=1S/C15H15NO2S/c16-14(17)11-19(18)15(12-7-3-1-4-8-12)13-9-5-2-6-10-13/h1-10,15H,11H2,(H2,16,17)",small molecule
600,DB00746,Deferoxamine,approved|investigational,Used to treat acute iron or aluminum toxicity (an excess of aluminum in the body) in certain patients,"InChI=1S/C25H48N6O8/c1-21(32)29(37)18-9-3-6-16-27-22(33)12-14-25(36)31(39)20-10-4-7-17-28-23(34)11-13-24(35)30(38)19-8-2-5-15-26/h37-39H,2-20,26H2,1H3,(H,27,33)(H,28,34)",small molecule
601,DB00747,Scopolamine,approved|investigational,Scopolamine is indicated in adult patients for the prevention of nausea and vomiting associated with motion sickness and for the prevention of postoperative nausea and vomiting (PONV) associated with anesthesia or opiate analgesia,"InChI=1S/C17H21NO4/c1-18-13-7-11(8-14(18)16-15(13)22-16)21-17(20)12(9-19)10-5-3-2-4-6-10/h2-6,11-16,19H,7-9H2,1H3/t11-,12-,13-,14+,15-,16+/m1/s1",small molecule
602,DB00748,Carbinoxamine,approved,"For symptomatic relief of seasonal and perennial allergic rhinitis and vasomotor rhinitis, as well as allergic conjunctivitis caused by foods and inhaled allergens","InChI=1S/C16H19ClN2O/c1-19(2)11-12-20-16(15-5-3-4-10-18-15)13-6-8-14(17)9-7-13/h3-10,16H,11-12H2,1-2H3",small molecule
603,DB00749,Etodolac,approved|investigational|vet_approved,"For acute and long-term management of signs and symptoms of osteoarthritis and rheumatoid arthritis, as well as for the management of pain","InChI=1S/C17H21NO3/c1-3-11-6-5-7-12-13-8-9-21-17(4-2,10-14(19)20)16(13)18-15(11)12/h5-7,18H,3-4,8-10H2,1-2H3,(H,19,20)",small molecule
604,DB00750,Prilocaine,approved,Used as a local anaesthetic and is often used in dentistry,"InChI=1S/C13H20N2O/c1-4-9-14-11(3)13(16)15-12-8-6-5-7-10(12)2/h5-8,11,14H,4,9H2,1-3H3,(H,15,16)",small molecule
605,DB00751,Epinastine,approved|investigational,For the prevention of itching associated with allergic conjunctivitis,"InChI=1S/C16H15N3/c17-16-18-10-15-13-7-3-1-5-11(13)9-12-6-2-4-8-14(12)19(15)16/h1-8,15H,9-10H2,(H2,17,18)",small molecule
606,DB00752,Tranylcypromine,approved|investigational,For the treatment of major depressive episode without melancholia,"InChI=1S/C9H11N/c10-9-6-8(9)7-4-2-1-3-5-7/h1-5,8-9H,6,10H2",small molecule
607,DB00753,Isoflurane,approved|vet_approved,For induction and maintenance of general anesthesia,"InChI=1S/C3H2ClF5O/c4-1(3(7,8)9)10-2(5)6/h1-2H",small molecule
608,DB00754,Ethotoin,approved,For the control of tonic-clonic (grand mal) and complex partial (psychomotor) seizures,"InChI=1S/C11H12N2O2/c1-2-13-10(14)9(12-11(13)15)8-6-4-3-5-7-8/h3-7,9H,2H2,1H3,(H,12,15)",small molecule
609,DB00755,Tretinoin,approved|investigational|nutraceutical,"For the the induction of remission in patients with acute promyelocytic leukemia (APL), French-American-British (FAB) classification M3 (including the M3 variant); For the topical treatment of acne vulgaris, flat warts and other skin conditions (psoriasis, ichthyosis congenita, icthyosis vulgaris, lamellar icthyosis, keratosis palmaris et plantaris, epidermolytic hyperkeratosis, senile comedones, senile keratosis, keratosis follicularis (Darier's disease), and basal cell carcinomas","InChI=1S/C20H28O2/c1-15(8-6-9-16(2)14-19(21)22)11-12-18-17(3)10-7-13-20(18,4)5/h6,8-9,11-12,14H,7,10,13H2,1-5H3,(H,21,22)/b9-6+,12-11+,15-8+,16-14+",small molecule
610,DB00756,Hexachlorophene,approved|withdrawn,For use as a surgical scrub and a bacteriostatic skin cleanser,"InChI=1S/C13H6Cl6O2/c14-6-2-8(16)12(20)4(10(6)18)1-5-11(19)7(15)3-9(17)13(5)21/h2-3,20-21H,1H2",small molecule
611,DB00757,Dolasetron,approved|investigational,"For the prevention of nausea and vomiting associated with emetogenic cancer chemotherapy, including initial and repeat courses of chemotherapy","InChI=1S/C19H20N2O3/c22-18-10-21-12-5-11(18)6-13(21)8-14(7-12)24-19(23)16-9-20-17-4-2-1-3-15(16)17/h1-4,9,11-14,20H,5-8,10H2/t11-,12-,13+,14+",small molecule
612,DB00758,Clopidogrel,approved,"Clopidogrel is indicated to reduce the risk of myocardial infarction for patients with non-ST elevated acute coronary syndrome (ACS), patients with ST-elevated myocardial infarction, and in recent MI, stroke, or established peripheral arterial disease,[L7213]","InChI=1S/C16H16ClNO2S/c1-20-16(19)15(12-4-2-3-5-13(12)17)18-8-6-14-11(10-18)7-9-21-14/h2-5,7,9,15H,6,8,10H2,1H3/t15-/m0/s1",small molecule
613,DB00759,Tetracycline,approved|vet_approved|withdrawn,"Used to treat bacterial infections such as Rocky Mountain spotted fever, typhus fever, tick fevers, Q fever, rickettsialpox and Brill-Zinsser disease","InChI=1S/C22H24N2O8/c1-21(31)8-5-4-6-11(25)12(8)16(26)13-9(21)7-10-15(24(2)3)17(27)14(20(23)30)19(29)22(10,32)18(13)28/h4-6,9-10,15,25,27-28,31-32H,7H2,1-3H3,(H2,23,30)/t9-,10-,15-,21+,22-/m0/s1",small molecule
614,DB00760,Meropenem,approved|investigational,"For use as single agent therapy for the treatment of the following infections when caused by susceptible isolates of the designated microorganisms: <b>complicated skin and skin structure infections</b> due to <i>Staphylococcus aureus</i> (b-lactamase and non-b-lactamase producing, methicillin-susceptible isolates only), <i>Streptococcus pyogenes</i>, <i>Streptococcus agalactiae</i>, viridans group streptococci, <i>Enterococcus faecalis</i> (excluding vancomycin-resistant isolates), <i>Pseudomonas aeruginosa</i>, <i>Escherichia coli</i>, <i>Proteus mirabilis</i>, <i>Bacteroides fragilis</i> and <i>Peptostreptococcus</i> species; <b>complicated appendicitis and peritonitis</b> caused by viridans group streptococci, <i>Escherichia coli</i>, <i>Klebsiella pneumoniae</i>, <i>Pseudomonas aeruginosa</i>, <i>Bacteroides fragilis</i>, <i>B","InChI=1S/C17H25N3O5S/c1-7-12-11(8(2)21)16(23)20(12)13(17(24)25)14(7)26-9-5-10(18-6-9)15(22)19(3)4/h7-12,18,21H,5-6H2,1-4H3,(H,24,25)/t7-,8-,9+,10+,11-,12-/m1/s1",small molecule
615,DB00761,Potassium chloride,approved|withdrawn,For use as an electrolyte replenisher and in the treatment of hypokalemia,InChI=1S/ClH.K/h1H;/q;+1/p-1,small molecule
616,DB00762,Irinotecan,approved|investigational,For the treatment of metastatic colorectal cancer (first-line therapy when administered with 5-fluorouracil and leucovorin),"InChI=1S/C33H38N4O6/c1-3-22-23-16-21(43-32(40)36-14-10-20(11-15-36)35-12-6-5-7-13-35)8-9-27(23)34-29-24(22)18-37-28(29)17-26-25(30(37)38)19-42-31(39)33(26,41)4-2/h8-9,16-17,20,41H,3-7,10-15,18-19H2,1-2H3/t33-/m0/s1",small molecule
617,DB00763,Methimazole,approved,"In the United States, methimazole is indicated for the treatment of hyperthyroidism in patients with Graves' disease or toxic multinodular goiter for whom thyroidectomy or radioactive iodine therapy are not appropriate treatment options","InChI=1S/C4H6N2S/c1-6-3-2-5-4(6)7/h2-3H,1H3,(H,5,7)",small molecule
618,DB00765,Metyrosine,approved,"For use in the treatment of patients with pheochromocytoma, for preoperative preparation of patients for surgery, management of patients when surgery is contraindicated, and chronic treatment of patients with malignant pheochromocytoma","InChI=1S/C10H13NO3/c1-10(11,9(13)14)6-7-2-4-8(12)5-3-7/h2-5,12H,6,11H2,1H3,(H,13,14)/t10-/m0/s1",small molecule
619,DB00766,Clavulanic acid,approved|vet_approved,Clavulanic acid combined with other antibiotics is indicated to prevent the development of drug-resistant strains of bacteria and promotes their therapeutic antibacterial effects,"InChI=1S/C8H9NO5/c10-2-1-4-7(8(12)13)9-5(11)3-6(9)14-4/h1,6-7,10H,2-3H2,(H,12,13)/b4-1-/t6-,7-/m1/s1",small molecule
620,DB00768,Olopatadine,approved,Olopatadine is indicated for the symptomatic treatment of ocular itching associated with allergic conjunctivitis as ophthalmic solution,"InChI=1S/C21H23NO3/c1-22(2)11-5-8-18-17-7-4-3-6-16(17)14-25-20-10-9-15(12-19(18)20)13-21(23)24/h3-4,6-10,12H,5,11,13-14H2,1-2H3,(H,23,24)/b18-8-",small molecule
621,DB00769,Hydrocortamate,approved,Used topically as an antiinflammatory in the treatment of steroid-responsive dermatoses,"InChI=1S/C27H41NO6/c1-5-28(6-2)15-23(32)34-16-22(31)27(33)12-10-20-19-8-7-17-13-18(29)9-11-25(17,3)24(19)21(30)14-26(20,27)4/h13,19-21,24,30,33H,5-12,14-16H2,1-4H3/t19-,20-,21-,24+,25-,26-,27-/m0/s1",small molecule
622,DB00770,Alprostadil,approved|investigational,"For palliative, not definitive, therapy to temporarily maintain the patency of the ductus arteriosus until corrective or palliative surgery can be performed in neonates who have congenital heart defects and who depend upon the patent ductus for survival","InChI=1S/C20H34O5/c1-2-3-6-9-15(21)12-13-17-16(18(22)14-19(17)23)10-7-4-5-8-11-20(24)25/h12-13,15-17,19,21,23H,2-11,14H2,1H3,(H,24,25)/b13-12+/t15-,16+,17+,19+/m0/s1",small molecule
623,DB00771,Clidinium,approved,"For the treatment of peptic ulcer disease and also to help relieve abdominal or stomach spasms or cramps due to colicky abdominal pain, diverticulitis, and irritable bowel syndrome","InChI=1S/C22H26NO3/c1-23-14-12-17(13-15-23)20(16-23)26-21(24)22(25,18-8-4-2-5-9-18)19-10-6-3-7-11-19/h2-11,17,20,25H,12-16H2,1H3/q+1/t17-,20?,23+",small molecule
624,DB00772,Malathion,approved|investigational,For patients infected with Pediculus humanus capitis (head lice and their ova) of the scalp hair,"InChI=1S/C10H19O6PS2/c1-5-15-9(11)7-8(10(12)16-6-2)19-17(18,13-3)14-4/h8H,5-7H2,1-4H3",small molecule
625,DB00773,Etoposide,approved,For use in combination with other chemotherapeutic agents in the treatment of refractory testicular tumors and as first line treatment in patients with small cell lung cancer,"InChI=1S/C29H32O13/c1-11-36-9-20-27(40-11)24(31)25(32)29(41-20)42-26-14-7-17-16(38-10-39-17)6-13(14)21(22-15(26)8-37-28(22)33)12-4-18(34-2)23(30)19(5-12)35-3/h4-7,11,15,20-22,24-27,29-32H,8-10H2,1-3H3/t11-,15+,20-,21-,22+,24-,25-,26-,27-,29+/m1/s1",small molecule
626,DB00774,Hydroflumethiazide,approved|investigational|withdrawn,"Used as adjunctive therapy in edema associated with congestive heart failure, hepatic cirrhosis, and corticosteroid and estrogen therapy","InChI=1S/C8H8F3N3O4S2/c9-8(10,11)4-1-5-7(2-6(4)19(12,15)16)20(17,18)14-3-13-5/h1-2,13-14H,3H2,(H2,12,15,16)",small molecule
627,DB00775,Tirofiban,approved,"For treatment, in combination with heparin, of acute coronary syndrome, including patients who are to be managed medically and those undergoing PTCA or atherectomy","InChI=1S/C22H36N2O5S/c1-2-3-16-30(27,28)24-21(22(25)26)17-19-7-9-20(10-8-19)29-15-5-4-6-18-11-13-23-14-12-18/h7-10,18,21,23-24H,2-6,11-17H2,1H3,(H,25,26)/t21-/m0/s1",small molecule
628,DB00776,Oxcarbazepine,approved,"In the United States, oxcarbazepine is indicated for use as monotherapy or adjunctive therapy in the treatment of partial-onset seizures in adults and as monotherapy in the treatment of partial-onset seizures in pediatric patients aged 4 years and above, and as adjunctive therapy in pediatric patients aged 2 years and above with partial-onset seizures","InChI=1S/C15H12N2O2/c16-15(19)17-12-7-3-1-5-10(12)9-14(18)11-6-2-4-8-13(11)17/h1-8H,9H2,(H2,16,19)",small molecule
629,DB00777,Propiomazine,approved,Propiomazine is largely used for its antihistamininc sleep inducing effects in treating insomnia,"InChI=1S/C20H24N2OS/c1-5-18(23)15-10-11-20-17(12-15)22(13-14(2)21(3)4)16-8-6-7-9-19(16)24-20/h6-12,14H,5,13H2,1-4H3",small molecule
630,DB00778,Roxithromycin,approved|investigational|withdrawn,"Used to treat respiratory tract, urinary and soft tissue infections","InChI=1S/C41H76N2O15/c1-15-29-41(10,49)34(45)24(4)31(42-53-21-52-17-16-50-13)22(2)19-39(8,48)36(58-38-32(44)28(43(11)12)18-23(3)54-38)25(5)33(26(6)37(47)56-29)57-30-20-40(9,51-14)35(46)27(7)55-30/h22-30,32-36,38,44-46,48-49H,15-21H2,1-14H3/b42-31+/t22-,23-,24+,25+,26-,27+,28+,29-,30+,32-,33+,34-,35+,36-,38+,39-,40-,41-/m1/s1",small molecule
631,DB00779,Nalidixic acid,approved|investigational,"For the treatment of urinary tract infections caused by susceptible gram-negative microorganisms, including the majority of <i>E","InChI=1S/C12H12N2O3/c1-3-14-6-9(12(16)17)10(15)8-5-4-7(2)13-11(8)14/h4-6H,3H2,1-2H3,(H,16,17)",small molecule
632,DB00780,Phenelzine,approved,"Phenelzine is indicated for the treatment of nonendogenous, neurotic or atypical depression for patients that do not tolerate other forms of therapy","InChI=1S/C8H12N2/c9-10-7-6-8-4-2-1-3-5-8/h1-5,10H,6-7,9H2",small molecule
633,DB00782,Propantheline,approved,For the treatment of enuresis,"InChI=1S/C23H30NO3/c1-16(2)24(5,17(3)4)14-15-26-23(25)22-18-10-6-8-12-20(18)27-21-13-9-7-11-19(21)22/h6-13,16-17,22H,14-15H2,1-5H3/q+1",small molecule
634,DB00783,Estradiol,approved|investigational|vet_approved,"Estradiol is indicated in various preparations for the treatment of moderate to severe vasomotor symptoms and vulvar and vaginal atrophy due to menopause, for the treatment of hypoestrogenism due to hypogonadism, castration, or primary ovarian failure, and for the prevention of postmenopausal osteoporosis","InChI=1S/C18H24O2/c1-18-9-8-14-13-5-3-12(19)10-11(13)2-4-15(14)16(18)6-7-17(18)20/h3,5,10,14-17,19-20H,2,4,6-9H2,1H3/t14-,15-,16+,17+,18+/m1/s1",small molecule
635,DB00784,Mefenamic acid,approved,"For the treatment of rheumatoid arthritis, osteoarthritis, dysmenorrhea, and mild to moderate pain, inflammation, and fever","InChI=1S/C15H15NO2/c1-10-6-5-9-13(11(10)2)16-14-8-4-3-7-12(14)15(17)18/h3-9,16H,1-2H3,(H,17,18)",small molecule
636,DB00787,Acyclovir,approved,An acyclovir topical cream is indicated to treat recurrent herpes labialis in immunocompetent patients 12 years and older,"InChI=1S/C8H11N5O3/c9-8-11-6-5(7(15)12-8)10-3-13(6)4-16-2-1-14/h3,14H,1-2,4H2,(H3,9,11,12,15)",small molecule
637,DB00788,Naproxen,approved|vet_approved,"Naproxen is indicated for the management of rheumatoid arthritis, osteoarthritis, ankylosing spondylitis, polyarticular juvenile idiopathic arthritis, tendinitis, bursitis, acute gout, primary dysmenorrhea, and for the relief of mild to moderate pain","InChI=1S/C14H14O3/c1-9(14(15)16)10-3-4-12-8-13(17-2)6-5-11(12)7-10/h3-9H,1-2H3,(H,15,16)/t9-/m0/s1",small molecule
