,drugbank_id,name,groups,indication,inchi,type
0,DB00006,Bivalirudin,approved|investigational,For treatment of heparin-induced thrombocytopenia and for the prevention of thrombosis,"InChI=1S/C98H138N24O33/c1-5-52(4)82(96(153)122-39-15-23-70(122)92(149)114-60(30-34-79(134)135)85(142)111-59(29-33-78(132)133)86(143)116-64(43-55-24-26-56(123)27-25-55)89(146)118-67(97(154)155)40-51(2)3)119-87(144)61(31-35-80(136)137)112-84(141)58(28-32-77(130)131)113-88(145)63(42-54-18-10-7-11-19-54)117-90(147)66(45-81(138)139)110-76(129)50-107-83(140)65(44-71(100)124)109-75(128)49-106-73(126)47-104-72(125)46-105-74(127)48-108-91(148)68-21-13-38-121(68)95(152)62(20-12-36-103-98(101)102)115-93(150)69-22-14-37-120(69)94(151)57(99)41-53-16-8-6-9-17-53/h6-11,16-19,24-27,51-52,57-70,82,123H,5,12-15,20-23,28-50,99H2,1-4H3,(H2,100,124)(H,104,125)(H,105,127)(H,106,126)(H,107,140)(H,108,148)(H,109,128)(H,110,129)(H,111,142)(H,112,141)(H,113,145)(H,114,149)(H,115,150)(H,116,143)(H,117,147)(H,118,146)(H,119,144)(H,130,131)(H,132,133)(H,134,135)(H,136,137)(H,138,139)(H,154,155)(H4,101,102,103)/t52-,57+,58-,59-,60-,61-,62-,63-,64-,65-,66-,67-,68-,69-,70-,82-/m0/s1",small molecule
1,DB00007,Leuprolide,approved|investigational,"Leuprolide is indicated for the treatment of advanced prostate cancer [L13781, L34415] and as palliative treatment of advanced prostate cancer","InChI=1S/C59H84N16O12/c1-6-63-57(86)48-14-10-22-75(48)58(87)41(13-9-21-64-59(60)61)68-51(80)42(23-32(2)3)69-52(81)43(24-33(4)5)70-53(82)44(25-34-15-17-37(77)18-16-34)71-56(85)47(30-76)74-54(83)45(26-35-28-65-39-12-8-7-11-38(35)39)72-55(84)46(27-36-29-62-31-66-36)73-50(79)40-19-20-49(78)67-40/h7-8,11-12,15-18,28-29,31-33,40-48,65,76-77H,6,9-10,13-14,19-27,30H2,1-5H3,(H,62,66)(H,63,86)(H,67,78)(H,68,80)(H,69,81)(H,70,82)(H,71,85)(H,72,84)(H,73,79)(H,74,83)(H4,60,61,64)/t40-,41-,42-,43+,44-,45-,46-,47-,48-/m0/s1",small molecule
2,DB00014,Goserelin,approved,"Goserelin is indicated for:

- Use in combination with flutamide for the management of locally confined carcinoma of the prostate
- Palliative treatment of advanced carcinoma of the prostate
- The management of endometriosis
- Use as an endometrial-thinning agent prior to endometrial ablation for dysfunctional uterine bleeding
- Use in the palliative treatment of advanced breast cancer in pre- and perimenopausal women","InChI=1S/C59H84N18O14/c1-31(2)22-40(49(82)68-39(12-8-20-64-57(60)61)56(89)77-21-9-13-46(77)55(88)75-76-58(62)90)69-54(87)45(29-91-59(3,4)5)74-50(83)41(23-32-14-16-35(79)17-15-32)70-53(86)44(28-78)73-51(84)42(24-33-26-65-37-11-7-6-10-36(33)37)71-52(85)43(25-34-27-63-30-66-34)72-48(81)38-18-19-47(80)67-38/h6-7,10-11,14-17,26-27,30-31,38-46,65,78-79H,8-9,12-13,18-25,28-29H2,1-5H3,(H,63,66)(H,67,80)(H,68,82)(H,69,87)(H,70,86)(H,71,85)(H,72,81)(H,73,84)(H,74,83)(H,75,88)(H4,60,61,64)(H3,62,76,90)/t38-,39-,40-,41-,42-,43-,44-,45+,46-/m0/s1",small molecule
3,DB00027,Gramicidin D,approved,"For treatment of skin lesions, surface wounds and eye infections","InChI=1S/C96H135N19O16/c1-50(2)36-71(105-79(118)48-102-93(128)80(54(9)10)103-49-117)86(121)104-58(17)84(119)113-82(56(13)14)95(130)115-83(57(15)16)96(131)114-81(55(11)12)94(129)112-78(43-62-47-101-70-33-25-21-29-66(62)70)92(127)108-74(39-53(7)8)89(124)111-77(42-61-46-100-69-32-24-20-28-65(61)69)91(126)107-73(38-52(5)6)88(123)110-76(41-60-45-99-68-31-23-19-27-64(60)68)90(125)106-72(37-51(3)4)87(122)109-75(85(120)97-34-35-116)40-59-44-98-67-30-22-18-26-63(59)67/h18-33,44-47,49-58,71-78,80-83,98-101,116H,34-43,48H2,1-17H3,(H,97,120)(H,102,128)(H,103,117)(H,104,121)(H,105,118)(H,106,125)(H,107,126)(H,108,127)(H,109,122)(H,110,123)(H,111,124)(H,112,129)(H,113,119)(H,114,131)(H,115,130)/t58-,71+,72+,73+,74+,75-,76-,77-,78-,80-,81+,82+,83-/m0/s1",small molecule
4,DB00035,Desmopressin,approved,- Indicated for the treatment of nocturia due to nocturnal polyuria in adults who awaken at least 2 times per night to void (intranasal),"InChI=1S/C46H64N14O12S2/c47-35(62)15-14-29-40(67)58-32(22-36(48)63)43(70)59-33(45(72)60-18-5-9-34(60)44(71)56-28(8-4-17-52-46(50)51)39(66)53-23-37(49)64)24-74-73-19-16-38(65)54-30(21-26-10-12-27(61)13-11-26)41(68)57-31(42(69)55-29)20-25-6-2-1-3-7-25/h1-3,6-7,10-13,28-34,61H,4-5,8-9,14-24H2,(H2,47,62)(H2,48,63)(H2,49,64)(H,53,66)(H,54,65)(H,55,69)(H,56,71)(H,57,68)(H,58,67)(H,59,70)(H4,50,51,52)/t28-,29+,30+,31+,32+,33+,34+/m1/s1",small molecule
5,DB00050,Cetrorelix,approved|investigational,For the inhibition of premature LH surges in women undergoing controlled ovarian stimulation,"InChI=1S/C70H92ClN17O14/c1-39(2)31-52(61(94)82-51(15-9-28-77-69(73)74)68(101)88-30-10-16-58(88)67(100)79-40(3)59(72)92)83-60(93)50(14-8-29-78-70(75)102)81-63(96)54(34-43-20-25-49(91)26-21-43)86-66(99)57(38-89)87-65(98)56(36-45-11-7-27-76-37-45)85-64(97)55(33-42-18-23-48(71)24-19-42)84-62(95)53(80-41(4)90)35-44-17-22-46-12-5-6-13-47(46)32-44/h5-7,11-13,17-27,32,37,39-40,50-58,89,91H,8-10,14-16,28-31,33-36,38H2,1-4H3,(H2,72,92)(H,79,100)(H,80,90)(H,81,96)(H,82,94)(H,83,93)(H,84,95)(H,85,97)(H,86,99)(H,87,98)(H4,73,74,77)(H3,75,78,102)/t40-,50-,51+,52+,53-,54+,55-,56-,57+,58+/m1/s1",small molecule
6,DB00067,Vasopressin,approved,Vasopressin is indicated to increase blood pressure in adults in vasodilatory shock refractory to the application of fluids and catecholamines,"InChI=1S/C46H65N15O12S2.C46H65N13O12S2/c47-27-22-74-75-23-33(45(73)61-17-5-9-34(61)44(72)56-28(8-4-16-53-46(51)52)39(67)54-21-37(50)65)60-43(71)32(20-36(49)64)59-40(68)29(14-15-35(48)63)55-41(69)31(18-24-6-2-1-3-7-24)58-42(70)30(57-38(27)66)19-25-10-12-26(62)13-11-25;47-17-5-4-9-29(40(65)52-22-38(51)63)54-45(70)35-10-6-18-59(35)46(71)34-24-73-72-23-28(48)39(64)55-31(20-26-11-13-27(60)14-12-26)43(68)56-32(19-25-7-2-1-3-8-25)42(67)53-30(15-16-36(49)61)41(66)57-33(21-37(50)62)44(69)58-34/h1-3,6-7,10-13,27-34,62H,4-5,8-9,14-23,47H2,(H2,48,63)(H2,49,64)(H2,50,65)(H,54,67)(H,55,69)(H,56,72)(H,57,66)(H,58,70)(H,59,68)(H,60,71)(H4,51,52,53);1-3,7-8,11-14,28-35,60H,4-6,9-10,15-24,47-48H2,(H2,49,61)(H2,50,62)(H2,51,63)(H,52,65)(H,53,67)(H,54,70)(H,55,64)(H,56,68)(H,57,66)(H,58,69)",small molecule
7,DB00080,Daptomycin,approved|investigational,Daptomycin is indicated for the treatment of complicated skin and skin structure infections (cSSSI) in patients one year of age and older,"InChI=1S/C72H101N17O26/c1-5-6-7-8-9-10-11-22-53(93)81-44(25-38-31-76-42-20-15-13-17-39(38)42)66(108)84-45(27-52(75)92)67(109)86-48(30-59(102)103)68(110)89-61-37(4)115-72(114)49(26-51(91)40-18-12-14-19-41(40)74)87-71(113)60(35(2)24-56(96)97)88-69(111)50(34-90)82-55(95)32-77-63(105)46(28-57(98)99)83-62(104)36(3)79-65(107)47(29-58(100)101)85-64(106)43(21-16-23-73)80-54(94)33-78-70(61)112/h12-15,17-20,31,35-37,43-50,60-61,76,90H,5-11,16,21-30,32-34,73-74H2,1-4H3,(H2,75,92)(H,77,105)(H,78,112)(H,79,107)(H,80,94)(H,81,93)(H,82,95)(H,83,104)(H,84,108)(H,85,106)(H,86,109)(H,87,113)(H,88,111)(H,89,110)(H,96,97)(H,98,99)(H,100,101)(H,102,103)/t35-,36-,37-,43+,44+,45-,46+,47+,48+,49+,50-,60+,61+/m1/s1",small molecule
8,DB00091,Cyclosporine,approved|investigational|vet_approved,Cyclosporine is approved for a variety of conditions,"InChI=1S/C62H111N11O12/c1-25-27-28-40(15)52(75)51-56(79)65-43(26-2)58(81)67(18)33-48(74)68(19)44(29-34(3)4)55(78)66-49(38(11)12)61(84)69(20)45(30-35(5)6)54(77)63-41(16)53(76)64-42(17)57(80)70(21)46(31-36(7)8)59(82)71(22)47(32-37(9)10)60(83)72(23)50(39(13)14)62(85)73(51)24/h25,27,34-47,49-52,75H,26,28-33H2,1-24H3,(H,63,77)(H,64,76)(H,65,79)(H,66,78)/b27-25+/t40-,41+,42-,43+,44+,45+,46+,47+,49+,50+,51+,52-/m1/s1",small molecule
9,DB00106,Abarelix,approved|investigational|withdrawn,For palliative treatment of advanced prostate cancer,"InChI=1S/C72H95ClN14O14/c1-41(2)32-54(64(93)80-53(17-10-11-30-77-42(3)4)72(101)87-31-13-18-60(87)69(98)78-43(5)63(75)92)81-68(97)58(38-62(74)91)84-70(99)61(37-46-22-27-52(90)28-23-46)86(7)71(100)59(40-88)85-67(96)57(36-48-14-12-29-76-39-48)83-66(95)56(34-45-20-25-51(73)26-21-45)82-65(94)55(79-44(6)89)35-47-19-24-49-15-8-9-16-50(49)33-47/h8-9,12,14-16,19-29,33,39,41-43,53-61,77,88,90H,10-11,13,17-18,30-32,34-38,40H2,1-7H3,(H2,74,91)(H2,75,92)(H,78,98)(H,79,89)(H,80,93)(H,81,97)(H,82,94)(H,83,95)(H,84,99)(H,85,96)/t43-,53+,54+,55-,56-,57-,58-,59+,60+,61+/m1/s1",small molecule
10,DB00114,Pyridoxal phosphate,approved|investigational|nutraceutical,For nutritional supplementation and for treating dietary shortage or imbalance,"InChI=1S/C8H10NO6P/c1-5-8(11)7(3-10)6(2-9-5)4-15-16(12,13)14/h2-3,11H,4H2,1H3,(H2,12,13,14)",small molecule
11,DB00115,Cyanocobalamin,approved|nutraceutical,"
**Nasal spray**

The cyanocobalamin nasal spray is indicated for the maintenance of vitamin B12 concentrations after normalization with intramuscular vitamin B12 therapy in patients with deficiency of this vitamin who have no nervous system involvement [FDA label]","InChI=1S/C62H90N13O14P.CN.Co/c1-29-20-39-40(21-30(29)2)75(28-70-39)57-52(84)53(41(27-76)87-57)89-90(85,86)88-31(3)26-69-49(83)18-19-59(8)37(22-46(66)80)56-62(11)61(10,25-48(68)82)36(14-17-45(65)79)51(74-62)33(5)55-60(9,24-47(67)81)34(12-15-43(63)77)38(71-55)23-42-58(6,7)35(13-16-44(64)78)50(72-42)32(4)54(59)73-56;1-2;/h20-21,23,28,31,34-37,41,52-53,56-57,76,84H,12-19,22,24-27H2,1-11H3,(H15,63,64,65,66,67,68,69,71,72,73,74,77,78,79,80,81,82,83,85,86);;/q;;+2/p-2/t31-,34-,35-,36-,37+,41-,52-,53-,56-,57+,59-,60+,61+,62+;;/m1../s1",small molecule
12,DB00118,Ademetionine,approved|investigational|nutraceutical,"S-Adenosylmethionine (SAMe) is used as a drug in Europe for the treatment of depression, liver disorders, fibromyalgia, and osteoarthritis","InChI=1S/C15H22N6O5S/c1-27(3-2-7(16)15(24)25)4-8-10(22)11(23)14(26-8)21-6-20-9-12(17)18-5-19-13(9)21/h5-8,10-11,14,22-23H,2-4,16H2,1H3,(H2-,17,18,19,24,25)/t7-,8+,10+,11+,14+,27?/m0/s1",small molecule
13,DB00119,Pyruvic acid,approved|investigational|nutraceutical,"For nutritional supplementation, also for treating dietary shortage or imbalance","InChI=1S/C3H4O3/c1-2(4)3(5)6/h1H3,(H,5,6)",small molecule
14,DB00120,Phenylalanine,approved|investigational|nutraceutical,L-phenylalanine may be helpful in some with depression,"InChI=1S/C9H11NO2/c10-8(9(11)12)6-7-4-2-1-3-5-7/h1-5,8H,6,10H2,(H,11,12)/t8-/m0/s1",small molecule
15,DB00121,Biotin,approved|investigational|nutraceutical,"For nutritional supplementation, also for treating dietary shortage or imbalance","InChI=1S/C10H16N2O3S/c13-8(14)4-2-1-3-7-9-6(5-16-7)11-10(15)12-9/h6-7,9H,1-5H2,(H,13,14)(H2,11,12,15)/t6-,7-,9-/m0/s1",small molecule
16,DB00122,Choline,approved|nutraceutical,"For nutritional supplementation, also for treating dietary shortage or imbalance","InChI=1S/C5H14NO/c1-6(2,3)4-5-7/h7H,4-5H2,1-3H3/q+1",small molecule
17,DB00123,Lysine,approved|nutraceutical,Supplemental lysine has putative anti-herpes simplex virus activity,"InChI=1S/C6H14N2O2/c7-4-2-1-3-5(8)6(9)10/h5H,1-4,7-8H2,(H,9,10)/t5-/m0/s1",small molecule
18,DB00126,Ascorbic acid,approved|nutraceutical,"Used to treat vitamin C deficiency, scurvy, delayed wound and bone healing, urine acidification, and in general as an antioxidant","InChI=1S/C6H8O6/c7-1-2(8)5-3(9)4(10)6(11)12-5/h2,5,7-10H,1H2/t2-,5+/m0/s1",small molecule
19,DB00128,Aspartic acid,approved|nutraceutical,"There is no support for the claim that aspartates are exercise performance enhancers, i","InChI=1S/C4H7NO4/c5-2(4(8)9)1-3(6)7/h2H,1,5H2,(H,6,7)(H,8,9)/t2-/m0/s1",small molecule
20,DB00129,Ornithine,approved|nutraceutical,"Used for nutritional supplementation, also for treating dietary shortage or imbalance","InChI=1S/C5H12N2O2/c6-3-1-2-4(7)5(8)9/h4H,1-3,6-7H2,(H,8,9)/t4-/m0/s1",small molecule
21,DB00130,L-Glutamine,approved|investigational|nutraceutical,"Used for nutritional supplementation, also for treating dietary shortage or imbalance","InChI=1S/C5H10N2O3/c6-3(5(9)10)1-2-4(7)8/h3H,1-2,6H2,(H2,7,8)(H,9,10)/t3-/m0/s1",small molecule
22,DB00131,Adenosine phosphate,approved|investigational|nutraceutical|withdrawn,"For nutritional supplementation, also for treating dietary shortage or imbalance","InChI=1S/C10H14N5O7P/c11-8-5-9(13-2-12-8)15(3-14-5)10-7(17)6(16)4(22-10)1-21-23(18,19)20/h2-4,6-7,10,16-17H,1H2,(H2,11,12,13)(H2,18,19,20)/t4-,6-,7-,10-/m1/s1",small molecule
23,DB00132,alpha-Linolenic acid,approved|investigational|nutraceutical,For nutritional supplementation and for treating dietary shortage or imbalance,"InChI=1S/C18H30O2/c1-2-3-4-5-6-7-8-9-10-11-12-13-14-15-16-17-18(19)20/h3-4,6-7,9-10H,2,5,8,11-17H2,1H3,(H,19,20)/b4-3-,7-6-,10-9-",small molecule
24,DB00134,Methionine,approved|nutraceutical,"Used for protein synthesis including the formation of SAMe, L-homocysteine, L-cysteine, taurine, and sulfate","InChI=1S/C5H11NO2S/c1-9-3-2-4(6)5(7)8/h4H,2-3,6H2,1H3,(H,7,8)/t4-/m0/s1",small molecule
25,DB00135,Tyrosine,approved|investigational|nutraceutical,"Tyrosine is claimed to act as an effective antidepressant, however results are mixed","InChI=1S/C9H11NO3/c10-8(9(12)13)5-6-1-3-7(11)4-2-6/h1-4,8,11H,5,10H2,(H,12,13)/t8-/m0/s1",small molecule
26,DB00136,Calcitriol,approved|nutraceutical,"Used to treat vitamin D deficiency or insufficiency, refractory rickets (vitamin D resistant rickets), familial hypophosphatemia and hypoparathyroidism, and in the management of hypocalcemia and renal osteodystrophy in patients with chronic renal failure undergoing dialysis","InChI=1S/C27H44O3/c1-18(8-6-14-26(3,4)30)23-12-13-24-20(9-7-15-27(23,24)5)10-11-21-16-22(28)17-25(29)19(21)2/h10-11,18,22-25,28-30H,2,6-9,12-17H2,1,3-5H3/b20-10+,21-11-/t18-,22-,23-,24+,25+,27-/m1/s1",small molecule
27,DB00137,Lutein,approved|investigational|nutraceutical,"Xanthophylls are taken for nutritional supplementation, and also for treating dietary shortage or imbalance","InChI=1S/C40H56O2/c1-29(17-13-19-31(3)21-23-37-33(5)25-35(41)27-39(37,7)8)15-11-12-16-30(2)18-14-20-32(4)22-24-38-34(6)26-36(42)28-40(38,9)10/h11-25,35-37,41-42H,26-28H2,1-10H3/b12-11+,17-13+,18-14+,23-21+,24-22+,29-15+,30-16+,31-19+,32-20+/t35-,36+,37-/m0/s1",small molecule
28,DB00138,Cystine,approved|nutraceutical,"It has been claimed that L-cysteine has anti-inflammatory properties, that it can protect against various toxins, and that it might be helpful in osteoarthritis and rheumatoid arthritis","InChI=1S/C6H12N2O4S2/c7-3(5(9)10)1-13-14-2-4(8)6(11)12/h3-4H,1-2,7-8H2,(H,9,10)(H,11,12)/t3-,4-/m0/s1",small molecule
29,DB00139,Succinic acid,approved|nutraceutical,"For nutritional supplementation, also for treating dietary shortage or imbalance","InChI=1S/C4H6O4/c5-3(6)1-2-4(7)8/h1-2H2,(H,5,6)(H,7,8)",small molecule
30,DB00140,Riboflavin,approved|investigational|nutraceutical|vet_approved,For the treatment of ariboflavinosis (vitamin B2 deficiency),"InChI=1S/C17H20N4O6/c1-7-3-9-10(4-8(7)2)21(5-11(23)14(25)12(24)6-22)15-13(18-9)16(26)20-17(27)19-15/h3-4,11-12,14,22-25H,5-6H2,1-2H3,(H,20,26,27)/t11-,12+,14-/m0/s1",small molecule
31,DB00141,N-Acetylglucosamine,approved|investigational|nutraceutical,"For the treatment and prevention of osteoarthritis, by itself or in combination with chondroitin sulfate","InChI=1S/C8H15NO6/c1-4(12)9-5(2-10)7(14)8(15)6(13)3-11/h2,5-8,11,13-15H,3H2,1H3,(H,9,12)/t5-,6+,7+,8+/m0/s1",small molecule
32,DB00142,Glutamic acid,approved|nutraceutical,"Considered to be nature's ""Brain food"" by improving mental capacities; helps speed the healing of ulcers; gives a ""lift"" from fatigue; helps control alcoholism, schizophrenia and the craving for sugar","InChI=1S/C5H9NO4/c6-3(5(9)10)1-2-4(7)8/h3H,1-2,6H2,(H,7,8)(H,9,10)/t3-/m0/s1",small molecule
33,DB00143,Glutathione,approved|investigational|nutraceutical,"For nutritional supplementation, also for treating dietary shortage or imbalance","InChI=1S/C10H17N3O6S/c11-5(10(18)19)1-2-7(14)13-6(4-20)9(17)12-3-8(15)16/h5-6,20H,1-4,11H2,(H,12,17)(H,13,14)(H,15,16)(H,18,19)/t5-,6-/m0/s1",small molecule
34,DB00145,Glycine,approved|nutraceutical|vet_approved,Supplemental glycine may have antispastic activity,"InChI=1S/C2H5NO2/c3-1-2(4)5/h1,3H2,(H,4,5)",small molecule
35,DB00146,Calcifediol,approved|nutraceutical,"Used to treat vitamin D deficiency or insufficiency, refractory rickets (vitamin D resistant rickets), familial hypophosphatemia and hypoparathyroidism, and in the management of hypocalcemia and renal osteodystrophy in patients with chronic renal failure undergoing dialysis","InChI=1S/C27H44O2/c1-19-10-13-23(28)18-22(19)12-11-21-9-7-17-27(5)24(14-15-25(21)27)20(2)8-6-16-26(3,4)29/h11-12,20,23-25,28-29H,1,6-10,13-18H2,2-5H3/b21-11+,22-12-/t20-,23+,24-,25+,27-/m1/s1",small molecule
36,DB00148,Creatine,approved|investigational|nutraceutical,"For nutritional supplementation, also for treating dietary shortage or imbalance","InChI=1S/C4H9N3O2/c1-7(4(5)6)2-3(8)9/h2H2,1H3,(H3,5,6)(H,8,9)",small molecule
37,DB00150,Tryptophan,approved|nutraceutical|withdrawn,"Tryptophan may be useful in increasing serotonin production, promoting healthy sleep, managing depression by enhancing mental and emotional well-being, managing pain tolerance, and managing weight","InChI=1S/C11H12N2O2/c12-9(11(14)15)5-7-6-13-10-4-2-1-3-8(7)10/h1-4,6,9,13H,5,12H2,(H,14,15)/t9-/m0/s1",small molecule
38,DB00151,Cysteine,approved|nutraceutical,For the prevention of liver damage and kidney damage associated with overdoses of acetaminophen,"InChI=1S/C3H7NO2S/c4-2(1-7)3(5)6/h2,7H,1,4H2,(H,5,6)/t2-/m0/s1",small molecule
39,DB00152,Thiamine,approved|investigational|nutraceutical|vet_approved,"For the treatment of thiamine and niacin deficiency states, Korsakov's alcoholic psychosis, Wernicke-Korsakov syndrome, delirium, and peripheral neuritis","InChI=1S/C12H17N4OS/c1-8-11(3-4-17)18-7-16(8)6-10-5-14-9(2)15-12(10)13/h5,7,17H,3-4,6H2,1-2H3,(H2,13,14,15)/q+1",small molecule
40,DB00153,Ergocalciferol,approved|nutraceutical,"Ergocalciferol is indicated for the treatment of hypoparathyroidism, refractory rickets, and familial hypophosphatemia","InChI=1S/C28H44O/c1-19(2)20(3)9-10-22(5)26-15-16-27-23(8-7-17-28(26,27)6)12-13-24-18-25(29)14-11-21(24)4/h9-10,12-13,19-20,22,25-27,29H,4,7-8,11,14-18H2,1-3,5-6H3/b10-9+,23-12+,24-13-/t20-,22+,25-,26+,27-,28+/m0/s1",small molecule
41,DB00156,Threonine,approved|nutraceutical,"L-Threonine makes up collagen, elastin, and enamel protein","InChI=1S/C4H9NO3/c1-2(6)3(5)4(7)8/h2-3,6H,5H2,1H3,(H,7,8)/t2-,3+/m1/s1",small molecule
42,DB00157,NADH,approved|nutraceutical,"Some evidence suggests that NADH might be useful in treating Parkinson's disease, chronic fatigue syndrome, Alzheimer's disease and cardiovascular disease","InChI=1S/C21H29N7O14P2/c22-17-12-19(25-7-24-17)28(8-26-12)21-16(32)14(30)11(41-21)6-39-44(36,37)42-43(34,35)38-5-10-13(29)15(31)20(40-10)27-3-1-2-9(4-27)18(23)33/h1,3-4,7-8,10-11,13-16,20-21,29-32H,2,5-6H2,(H2,23,33)(H,34,35)(H,36,37)(H2,22,24,25)/t10-,11-,13-,14-,15-,16-,20-,21-/m1/s1",small molecule
43,DB00158,Folic acid,approved|nutraceutical|vet_approved,"Folic acid is indicated for the treatment of folic acid deficiency, megaloblastic anemia, and in anemias of nutritional origins, pregnancy, infancy, or childhood","InChI=1S/C19H19N7O6/c20-19-25-15-14(17(30)26-19)23-11(8-22-15)7-21-10-3-1-9(2-4-10)16(29)24-12(18(31)32)5-6-13(27)28/h1-4,8,12,21H,5-7H2,(H,24,29)(H,27,28)(H,31,32)(H3,20,22,25,26,30)/t12-/m0/s1",small molecule
44,DB00159,Icosapent,approved|nutraceutical,EPA can be used for lowering elevated triglycerides in those who are hyperglyceridemic,"InChI=1S/C20H30O2/c1-2-3-4-5-6-7-8-9-10-11-12-13-14-15-16-17-18-19-20(21)22/h3-4,6-7,9-10,12-13,15-16H,2,5,8,11,14,17-19H2,1H3,(H,21,22)/b4-3-,7-6-,10-9-,13-12-,16-15-",small molecule
45,DB00161,Valine,approved|nutraceutical,"Promotes mental vigor, muscle coordination, and calm emotions","InChI=1S/C5H11NO2/c1-3(2)4(6)5(7)8/h3-4H,6H2,1-2H3,(H,7,8)/t4-/m0/s1",small molecule
46,DB00162,Vitamin A,approved|nutraceutical|vet_approved,For the treatment of vitamin A deficiency,"InChI=1S/C20H30O/c1-16(8-6-9-17(2)13-15-21)11-12-19-18(3)10-7-14-20(19,4)5/h6,8-9,11-13,21H,7,10,14-15H2,1-5H3/b9-6+,12-11+,16-8+,17-13+",small molecule
47,DB00163,Vitamin E,approved|nutraceutical|vet_approved,"Vitamin E supplementation is indicated for treatment of vitamin E deficiency which can occur in cystic fibrosis, cholestasis and severe liver disease, abetalipoproteinemia or simply poor diet[A176104,L3063]","InChI=1S/C29H50O2/c1-20(2)12-9-13-21(3)14-10-15-22(4)16-11-18-29(8)19-17-26-25(7)27(30)23(5)24(6)28(26)31-29/h20-22,30H,9-19H2,1-8H3/t21-,22-,29-/m1/s1",small molecule
48,DB00165,Pyridoxine,approved|investigational|nutraceutical|vet_approved,Pyridoxine is indicated for the treatment of vitamin B6 deficiency and for the prophylaxis of [DB00951]-induced peripheral neuropathy,"InChI=1S/C8H11NO3/c1-5-8(12)7(4-11)6(3-10)2-9-5/h2,10-12H,3-4H2,1H3",small molecule
49,DB00166,Lipoic acid,approved|investigational|nutraceutical,"For nutritional supplementation, also for treating dietary shortage or imbalance","InChI=1S/C8H14O2S2/c9-8(10)4-2-1-3-7-5-6-11-12-7/h7H,1-6H2,(H,9,10)/t7-/m1/s1",small molecule
50,DB00169,Cholecalciferol,approved|nutraceutical,"Cholecalciferol use is indicated for the treatment of specific medical conditions like refractory rickets (or vitamin D resistant rickets), hypoparathyroidism, and familial hypophosphatemia [F4027, F4042]","InChI=1S/C27H44O/c1-19(2)8-6-9-21(4)25-15-16-26-22(10-7-17-27(25,26)5)12-13-23-18-24(28)14-11-20(23)3/h12-13,19,21,24-26,28H,3,6-11,14-18H2,1-2,4-5H3/b22-12+,23-13-/t21-,24+,25-,26+,27-/m1/s1",small molecule
51,DB00170,Menadione,approved|nutraceutical,"The primary known function of vitamin K is to assist in the normal clotting of blood, but it may also play a role in normal bone calcification","InChI=1S/C11H8O2/c1-7-6-10(12)8-4-2-3-5-9(8)11(7)13/h2-6H,1H3",small molecule
52,DB00173,Adenine,approved|nutraceutical,"For nutritional supplementation, also for treating dietary shortage or imbalance","InChI=1S/C5H5N5/c6-4-3-5(9-1-7-3)10-2-8-4/h1-2H,(H3,6,7,8,9,10)",small molecule
53,DB00174,Asparagine,approved|investigational|nutraceutical,"Used for nutritional supplementation, also for treating dietary shortage or imbalance","InChI=1S/C4H8N2O3/c5-2(4(8)9)1-3(6)7/h2H,1,5H2,(H2,6,7)(H,8,9)/t2-/m0/s1",small molecule
54,DB00175,Pravastatin,approved,Pravastatin is indicated for primary prevention of coronary events hypercholesterolemic patients without clinical evidence of coronary heart disease,"InChI=1S/C23H36O7/c1-4-13(2)23(29)30-20-11-17(25)9-15-6-5-14(3)19(22(15)20)8-7-16(24)10-18(26)12-21(27)28/h5-6,9,13-14,16-20,22,24-26H,4,7-8,10-12H2,1-3H3,(H,27,28)/t13-,14-,16+,17+,18+,19-,20-,22-/m0/s1",small molecule
55,DB00176,Fluvoxamine,approved|investigational,Indicated predominantly for the management of depression and for Obsessive Compulsive Disorder (OCD) [FDA Label],"InChI=1S/C15H21F3N2O2/c1-21-10-3-2-4-14(20-22-11-9-19)12-5-7-13(8-6-12)15(16,17)18/h5-8H,2-4,9-11,19H2,1H3/b20-14+",small molecule
56,DB00177,Valsartan,approved|investigational,"Valsartan is indicated for the treatment of hypertension to reduce the risk of fatal and nonfatal cardiovascular events, primarily strokes and myocardial infarctions","InChI=1S/C24H29N5O3/c1-4-5-10-21(30)29(22(16(2)3)24(31)32)15-17-11-13-18(14-12-17)19-8-6-7-9-20(19)23-25-27-28-26-23/h6-9,11-14,16,22H,4-5,10,15H2,1-3H3,(H,31,32)(H,25,26,27,28)/t22-/m0/s1",small molecule
57,DB00178,Ramipril,approved,For the management of mild to severe hypertension,"InChI=1S/C23H32N2O5/c1-3-30-23(29)18(13-12-16-8-5-4-6-9-16)24-15(2)21(26)25-19-11-7-10-17(19)14-20(25)22(27)28/h4-6,8-9,15,17-20,24H,3,7,10-14H2,1-2H3,(H,27,28)/t15-,17-,18-,19-,20-/m0/s1",small molecule
58,DB00179,Masoprocol,approved|investigational,Used for the treatment of actinic keratoses (precancerous skin growths that can become malignant if left untreated),"InChI=1S/C18H22O4/c1-11(7-13-3-5-15(19)17(21)9-13)12(2)8-14-4-6-16(20)18(22)10-14/h3-6,9-12,19-22H,7-8H2,1-2H3/t11-,12+",small molecule
59,DB00180,Flunisolide,approved|investigational,For the maintenance treatment of asthma as a prophylactic therapy,"InChI=1S/C24H31FO6/c1-21(2)30-19-9-14-13-8-16(25)15-7-12(27)5-6-22(15,3)20(13)17(28)10-23(14,4)24(19,31-21)18(29)11-26/h5-7,13-14,16-17,19-20,26,28H,8-11H2,1-4H3/t13-,14-,16-,17-,19+,20+,22-,23-,24+/m0/s1",small molecule
60,DB00181,Baclofen,approved,"Oral baclofen is indicated for the treatment of spasticity resulting from multiple sclerosis and is particularly useful for the relief of flexor spasms and concomitant pain, clonus, and muscular rigidity","InChI=1S/C10H12ClNO2/c11-9-3-1-7(2-4-9)8(6-12)5-10(13)14/h1-4,8H,5-6,12H2,(H,13,14)",small molecule
61,DB00182,Amphetamine,approved|illicit|investigational,Amphetamine is indicated for the treatment of attention-deficit/hyperactivity disorders (ADHD) as well as for the treatment of central nervous system disorders such as narcolepsy,"InChI=1S/C9H13N/c1-8(10)7-9-5-3-2-4-6-9/h2-6,8H,7,10H2,1H3",small molecule
62,DB00183,Pentagastrin,approved,Used as a diagnostic aid for evaluation of gastric acid secretory function,"InChI=1S/C37H49N7O9S/c1-37(2,3)53-36(52)39-16-14-30(45)41-28(19-23-21-40-25-13-9-8-12-24(23)25)34(50)42-26(15-17-54-4)33(49)44-29(20-31(46)47)35(51)43-27(32(38)48)18-22-10-6-5-7-11-22/h5-13,21,26-29,40H,14-20H2,1-4H3,(H2,38,48)(H,39,52)(H,41,45)(H,42,50)(H,43,51)(H,44,49)(H,46,47)/t26-,27-,28-,29-/m0/s1",small molecule
63,DB00184,Nicotine,approved,For the relief of nicotine withdrawal symptoms and as an aid to smoking cessation,"InChI=1S/C10H14N2/c1-12-7-3-5-10(12)9-4-2-6-11-8-9/h2,4,6,8,10H,3,5,7H2,1H3/t10-/m0/s1",small molecule
64,DB00185,Cevimeline,approved,For the treatment of symptoms of dry mouth in patients with Sj&ouml;gren's Syndrome,"InChI=1S/C10H17NOS/c1-8-12-10(7-13-8)6-11-4-2-9(10)3-5-11/h8-9H,2-7H2,1H3/t8?,10-/m1/s1",small molecule
65,DB00186,Lorazepam,approved,Lorazepam is FDA-approved for the short-term relief of anxiety symptoms related to anxiety disorders and anxiety associated with depressive symptoms such as anxiety-associated insomnia,"InChI=1S/C15H10Cl2N2O2/c16-8-5-6-12-10(7-8)13(19-15(21)14(20)18-12)9-3-1-2-4-11(9)17/h1-7,15,21H,(H,18,20)",small molecule
